21:39:44.645913 IP 10.10.1.120.39511 > 172.29.4.66.domain: 38693+ TXT? _nfsv4idmapdomain. (35)
21:39:44.648008 IP 10.10.1.120.43943 > 172.29.4.66.domain: 38693+ TXT? _nfsv4idmapdomain. (35)
21:40:10.726075 IP 10.10.1.120.60399 > 172.29.4.66.domain: 1+ A? www.mimicdns.com. (34)
21:40:10.726229 IP 10.10.1.120.60399 > 172.29.4.66.domain: 2+ A? host.domain. (29)
21:40:10.726508 IP 10.10.1.120.60399 > 172.29.4.66.domain: 3+ A? www.mimicdns.com. (34)
21:40:10.726545 IP 10.10.1.120.60399 > 172.29.4.66.domain: 4+ A? host.domain. (29)
21:40:10.726664 IP 10.10.1.120.60399 > 172.29.4.66.domain: 5+ A? www.mimicdns.com. (34)
21:40:10.726665 IP 10.10.1.120.60399 > 172.29.4.66.domain: 6+ A? host.domain. (29)
21:40:10.726768 IP 10.10.1.120.60399 > 172.29.4.66.domain: 7+ A? www.mimicdns.com. (34)
21:40:10.726830 IP 10.10.1.120.60399 > 172.29.4.66.domain: 8+ A? host.domain. (29)
21:40:10.726867 IP 10.10.1.120.60399 > 172.29.4.66.domain: 9+ A? www.mimicdns.com. (34)
21:40:10.726942 IP 10.10.1.120.60399 > 172.29.4.66.domain: 10+ A? host.domain. (29)
21:40:10.727012 IP 10.10.1.120.60399 > 172.29.4.66.domain: 11+ A? www.mimicdns.com. (34)
21:40:10.727149 IP 10.10.1.120.60399 > 172.29.4.66.domain: 12+ A? host.domain. (29)
21:40:10.727262 IP 10.10.1.120.60399 > 172.29.4.66.domain: 13+ A? www.mimicdns.com. (34)
21:40:10.727405 IP 10.10.1.120.60399 > 172.29.4.66.domain: 14+ A? host.domain. (29)
21:40:10.727448 IP 10.10.1.120.60399 > 172.29.4.66.domain: 15+ A? www.mimicdns.com. (34)
21:40:10.727589 IP 10.10.1.120.60399 > 172.29.4.66.domain: 16+ A? host.domain. (29)
21:40:10.727701 IP 10.10.1.120.60399 > 172.29.4.66.domain: 17+ A? www.mimicdns.com. (34)
21:40:10.727813 IP 10.10.1.120.60399 > 172.29.4.66.domain: 18+ A? host.domain. (29)
21:40:10.727926 IP 10.10.1.120.60399 > 172.29.4.66.domain: 19+ A? www.mimicdns.com. (34)
21:40:10.727968 IP 10.10.1.120.60399 > 172.29.4.66.domain: 20+ A? host.domain. (29)
21:40:12.727636 IP 10.10.1.120.60399 > 172.29.4.66.domain: 21+ A? www.mimicdns.com. (34)
21:40:12.727803 IP 10.10.1.120.60399 > 172.29.4.66.domain: 22+ A? host.domain. (29)
21:40:12.728003 IP 10.10.1.120.60399 > 172.29.4.66.domain: 23+ A? www.mimicdns.com. (34)
21:40:12.728252 IP 10.10.1.120.60399 > 172.29.4.66.domain: 24+ A? host.domain. (29)
21:40:12.728366 IP 10.10.1.120.60399 > 172.29.4.66.domain: 25+ A? www.mimicdns.com. (34)
21:40:12.728476 IP 10.10.1.120.60399 > 172.29.4.66.domain: 26+ A? host.domain. (29)
21:40:12.728590 IP 10.10.1.120.60399 > 172.29.4.66.domain: 27+ A? www.mimicdns.com. (34)
21:40:12.728650 IP 10.10.1.120.60399 > 172.29.4.66.domain: 28+ A? host.domain. (29)
21:40:12.728770 IP 10.10.1.120.60399 > 172.29.4.66.domain: 29+ A? www.mimicdns.com. (34)
21:40:12.728891 IP 10.10.1.120.60399 > 172.29.4.66.domain: 30+ A? host.domain. (29)
21:40:12.728892 IP 10.10.1.120.60399 > 172.29.4.66.domain: 31+ A? www.mimicdns.com. (34)
21:40:12.728986 IP 10.10.1.120.60399 > 172.29.4.66.domain: 32+ A? host.domain. (29)
21:40:12.729106 IP 10.10.1.120.60399 > 172.29.4.66.domain: 33+ A? www.mimicdns.com. (34)
21:40:12.729168 IP 10.10.1.120.60399 > 172.29.4.66.domain: 34+ A? host.domain. (29)
21:40:12.729275 IP 10.10.1.120.60399 > 172.29.4.66.domain: 35+ A? www.mimicdns.com. (34)
21:40:12.729386 IP 10.10.1.120.60399 > 172.29.4.66.domain: 36+ A? host.domain. (29)
21:40:12.729476 IP 10.10.1.120.60399 > 172.29.4.66.domain: 37+ A? www.mimicdns.com. (34)
21:40:12.729588 IP 10.10.1.120.60399 > 172.29.4.66.domain: 38+ A? host.domain. (29)
21:40:12.729607 IP 10.10.1.120.60399 > 172.29.4.66.domain: 39+ A? www.mimicdns.com. (34)
21:40:12.729700 IP 10.10.1.120.60399 > 172.29.4.66.domain: 40+ A? host.domain. (29)
21:40:14.651270 IP 10.10.1.120.55968 > 172.29.4.66.domain: 33635+ TXT? _nfsv4idmapdomain. (35)
21:40:14.654093 IP 10.10.1.120.52148 > 172.29.4.66.domain: 33635+ TXT? _nfsv4idmapdomain. (35)
21:40:14.729256 IP 10.10.1.120.60399 > 172.29.4.66.domain: 41+ A? www.mimicdns.com. (34)
21:40:14.729387 IP 10.10.1.120.60399 > 172.29.4.66.domain: 42+ A? host.domain. (29)
21:40:14.729500 IP 10.10.1.120.60399 > 172.29.4.66.domain: 43+ A? www.mimicdns.com. (34)
21:40:14.729620 IP 10.10.1.120.60399 > 172.29.4.66.domain: 44+ A? host.domain. (29)
21:40:14.729738 IP 10.10.1.120.60399 > 172.29.4.66.domain: 45+ A? www.mimicdns.com. (34)
21:40:14.729850 IP 10.10.1.120.60399 > 172.29.4.66.domain: 46+ A? host.domain. (29)
21:40:14.729964 IP 10.10.1.120.60399 > 172.29.4.66.domain: 47+ A? www.mimicdns.com. (34)
21:40:14.730075 IP 10.10.1.120.60399 > 172.29.4.66.domain: 48+ A? host.domain. (29)
21:40:14.730164 IP 10.10.1.120.60399 > 172.29.4.66.domain: 49+ A? www.mimicdns.com. (34)
21:40:14.730261 IP 10.10.1.120.60399 > 172.29.4.66.domain: 50+ A? host.domain. (29)
21:40:14.730369 IP 10.10.1.120.60399 > 172.29.4.66.domain: 51+ A? www.mimicdns.com. (34)
21:40:14.730447 IP 10.10.1.120.60399 > 172.29.4.66.domain: 52+ A? host.domain. (29)
21:40:14.730523 IP 10.10.1.120.60399 > 172.29.4.66.domain: 53+ A? www.mimicdns.com. (34)
21:40:14.730524 IP 10.10.1.120.60399 > 172.29.4.66.domain: 54+ A? host.domain. (29)
21:40:14.730641 IP 10.10.1.120.60399 > 172.29.4.66.domain: 55+ A? www.mimicdns.com. (34)
21:40:14.730642 IP 10.10.1.120.60399 > 172.29.4.66.domain: 56+ A? host.domain. (29)
21:40:14.730752 IP 10.10.1.120.60399 > 172.29.4.66.domain: 57+ A? www.mimicdns.com. (34)
21:40:14.730835 IP 10.10.1.120.60399 > 172.29.4.66.domain: 58+ A? host.domain. (29)
21:40:14.730937 IP 10.10.1.120.60399 > 172.29.4.66.domain: 59+ A? www.mimicdns.com. (34)
21:40:14.731049 IP 10.10.1.120.60399 > 172.29.4.66.domain: 60+ A? host.domain. (29)
21:40:16.726972 IP 10.10.1.120.60399 > 172.29.4.66.domain: 61+ A? www.mimicdns.com. (34)
21:40:16.727113 IP 10.10.1.120.60399 > 172.29.4.66.domain: 62+ A? host.domain. (29)
21:40:16.727225 IP 10.10.1.120.60399 > 172.29.4.66.domain: 63+ A? www.mimicdns.com. (34)
21:40:16.727470 IP 10.10.1.120.60399 > 172.29.4.66.domain: 64+ A? host.domain. (29)
21:40:16.727659 IP 10.10.1.120.60399 > 172.29.4.66.domain: 65+ A? www.mimicdns.com. (34)
21:40:16.727773 IP 10.10.1.120.60399 > 172.29.4.66.domain: 66+ A? host.domain. (29)
21:40:16.727888 IP 10.10.1.120.60399 > 172.29.4.66.domain: 67+ A? www.mimicdns.com. (34)
21:40:16.727989 IP 10.10.1.120.60399 > 172.29.4.66.domain: 68+ A? host.domain. (29)
21:40:16.728112 IP 10.10.1.120.60399 > 172.29.4.66.domain: 69+ A? www.mimicdns.com. (34)
21:40:16.728113 IP 10.10.1.120.60399 > 172.29.4.66.domain: 70+ A? host.domain. (29)
21:40:16.728226 IP 10.10.1.120.60399 > 172.29.4.66.domain: 71+ A? www.mimicdns.com. (34)
21:40:16.728329 IP 10.10.1.120.60399 > 172.29.4.66.domain: 72+ A? host.domain. (29)
21:40:16.728442 IP 10.10.1.120.60399 > 172.29.4.66.domain: 73+ A? www.mimicdns.com. (34)
21:40:16.728506 IP 10.10.1.120.60399 > 172.29.4.66.domain: 74+ A? host.domain. (29)
21:40:16.728614 IP 10.10.1.120.60399 > 172.29.4.66.domain: 75+ A? www.mimicdns.com. (34)
21:40:16.728720 IP 10.10.1.120.60399 > 172.29.4.66.domain: 76+ A? host.domain. (29)
21:40:16.728807 IP 10.10.1.120.60399 > 172.29.4.66.domain: 77+ A? www.mimicdns.com. (34)
21:40:16.728866 IP 10.10.1.120.60399 > 172.29.4.66.domain: 78+ A? host.domain. (29)
21:40:16.728969 IP 10.10.1.120.60399 > 172.29.4.66.domain: 79+ A? www.mimicdns.com. (34)
21:40:16.729075 IP 10.10.1.120.60399 > 172.29.4.66.domain: 80+ A? host.domain. (29)
21:40:18.728983 IP 10.10.1.120.60399 > 172.29.4.66.domain: 81+ A? www.mimicdns.com. (34)
21:40:18.729149 IP 10.10.1.120.60399 > 172.29.4.66.domain: 82+ A? host.domain. (29)
21:40:18.729262 IP 10.10.1.120.60399 > 172.29.4.66.domain: 83+ A? www.mimicdns.com. (34)
21:40:18.729391 IP 10.10.1.120.60399 > 172.29.4.66.domain: 84+ A? host.domain. (29)
21:40:18.729655 IP 10.10.1.120.60399 > 172.29.4.66.domain: 85+ A? www.mimicdns.com. (34)
21:40:18.729769 IP 10.10.1.120.60399 > 172.29.4.66.domain: 86+ A? host.domain. (29)
21:40:18.729857 IP 10.10.1.120.60399 > 172.29.4.66.domain: 87+ A? www.mimicdns.com. (34)
21:40:18.729926 IP 10.10.1.120.60399 > 172.29.4.66.domain: 88+ A? host.domain. (29)
21:40:18.730033 IP 10.10.1.120.60399 > 172.29.4.66.domain: 89+ A? www.mimicdns.com. (34)
21:40:18.730220 IP 10.10.1.120.60399 > 172.29.4.66.domain: 90+ A? host.domain. (29)
21:40:18.730332 IP 10.10.1.120.60399 > 172.29.4.66.domain: 91+ A? www.mimicdns.com. (34)
21:40:18.730431 IP 10.10.1.120.60399 > 172.29.4.66.domain: 92+ A? host.domain. (29)
21:40:18.730536 IP 10.10.1.120.60399 > 172.29.4.66.domain: 93+ A? www.mimicdns.com. (34)
21:40:18.730598 IP 10.10.1.120.60399 > 172.29.4.66.domain: 94+ A? host.domain. (29)
21:40:18.730715 IP 10.10.1.120.60399 > 172.29.4.66.domain: 95+ A? www.mimicdns.com. (34)
21:40:18.730820 IP 10.10.1.120.60399 > 172.29.4.66.domain: 96+ A? host.domain. (29)
21:40:18.730927 IP 10.10.1.120.60399 > 172.29.4.66.domain: 97+ A? www.mimicdns.com. (34)
21:40:18.730986 IP 10.10.1.120.60399 > 172.29.4.66.domain: 98+ A? host.domain. (29)
21:40:18.731072 IP 10.10.1.120.60399 > 172.29.4.66.domain: 99+ A? www.mimicdns.com. (34)
21:40:18.731184 IP 10.10.1.120.60399 > 172.29.4.66.domain: 100+ A? host.domain. (29)
21:40:44.657306 IP 10.10.1.120.45561 > 172.29.4.66.domain: 26188+ TXT? _nfsv4idmapdomain. (35)
21:40:44.659949 IP 10.10.1.120.58845 > 172.29.4.66.domain: 26188+ TXT? _nfsv4idmapdomain. (35)
21:41:14.663364 IP 10.10.1.120.51690 > 172.29.4.66.domain: 58651+ TXT? _nfsv4idmapdomain. (35)
21:41:14.665701 IP 10.10.1.120.48332 > 172.29.4.66.domain: 58651+ TXT? _nfsv4idmapdomain. (35)
21:41:44.669921 IP 10.10.1.120.63008 > 172.29.4.66.domain: 58741+ TXT? _nfsv4idmapdomain. (35)
21:41:44.673307 IP 10.10.1.120.34201 > 172.29.4.66.domain: 58741+ TXT? _nfsv4idmapdomain. (35)
21:42:14.676522 IP 10.10.1.120.50678 > 172.29.4.66.domain: 39426+ TXT? _nfsv4idmapdomain. (35)
21:42:14.678237 IP 10.10.1.120.60104 > 172.29.4.66.domain: 39426+ TXT? _nfsv4idmapdomain. (35)
21:42:44.617883 IP 10.10.1.120.56132 > 172.29.4.66.domain: 26079+ TXT? _nfsv4idmapdomain. (35)
21:42:44.620284 IP 10.10.1.120.46170 > 172.29.4.66.domain: 26079+ TXT? _nfsv4idmapdomain. (35)
21:42:44.680097 IP 10.10.1.120.36173 > 172.29.4.66.domain: 31938+ TXT? _nfsv4idmapdomain. (35)
21:42:44.683070 IP 10.10.1.120.32934 > 172.29.4.66.domain: 31938+ TXT? _nfsv4idmapdomain. (35)
21:43:14.686133 IP 10.10.1.120.42297 > 172.29.4.66.domain: 39174+ TXT? _nfsv4idmapdomain. (35)
21:43:14.689234 IP 10.10.1.120.49009 > 172.29.4.66.domain: 39174+ TXT? _nfsv4idmapdomain. (35)
21:43:44.694336 IP 10.10.1.120.39277 > 172.29.4.66.domain: 16029+ TXT? _nfsv4idmapdomain. (35)
21:43:44.696346 IP 10.10.1.120.46056 > 172.29.4.66.domain: 16029+ TXT? _nfsv4idmapdomain. (35)
21:44:14.700888 IP 10.10.1.120.42929 > 172.29.4.66.domain: 11532+ TXT? _nfsv4idmapdomain. (35)
21:44:14.703660 IP 10.10.1.120.50807 > 172.29.4.66.domain: 11532+ TXT? _nfsv4idmapdomain. (35)
21:44:44.705625 IP 10.10.1.120.50374 > 172.29.4.66.domain: 5022+ TXT? _nfsv4idmapdomain. (35)
21:44:44.707942 IP 10.10.1.120.54895 > 172.29.4.66.domain: 5022+ TXT? _nfsv4idmapdomain. (35)
21:45:14.713074 IP 10.10.1.120.36022 > 172.29.4.66.domain: 64672+ TXT? _nfsv4idmapdomain. (35)
21:45:14.716230 IP 10.10.1.120.63264 > 172.29.4.66.domain: 64672+ TXT? _nfsv4idmapdomain. (35)
21:45:44.722597 IP 10.10.1.120.65310 > 172.29.4.66.domain: 46784+ TXT? _nfsv4idmapdomain. (35)
21:45:44.724831 IP 10.10.1.120.51819 > 172.29.4.66.domain: 46784+ TXT? _nfsv4idmapdomain. (35)
21:46:14.739937 IP 10.10.1.120.63154 > 172.29.4.66.domain: 32159+ TXT? _nfsv4idmapdomain. (35)
21:46:14.742855 IP 10.10.1.120.47653 > 172.29.4.66.domain: 32159+ TXT? _nfsv4idmapdomain. (35)
21:46:44.756499 IP 10.10.1.120.53210 > 172.29.4.66.domain: 54029+ TXT? _nfsv4idmapdomain. (35)
21:46:44.758683 IP 10.10.1.120.40078 > 172.29.4.66.domain: 54029+ TXT? _nfsv4idmapdomain. (35)
21:47:14.761464 IP 10.10.1.120.62709 > 172.29.4.66.domain: 46372+ TXT? _nfsv4idmapdomain. (35)
21:47:14.764704 IP 10.10.1.120.36262 > 172.29.4.66.domain: 46372+ TXT? _nfsv4idmapdomain. (35)
21:47:44.634480 IP 10.10.1.120.61180 > 172.29.4.66.domain: 27837+ TXT? _nfsv4idmapdomain. (35)
21:47:44.636449 IP 10.10.1.120.39729 > 172.29.4.66.domain: 27837+ TXT? _nfsv4idmapdomain. (35)
21:47:44.775106 IP 10.10.1.120.47506 > 172.29.4.66.domain: 33120+ TXT? _nfsv4idmapdomain. (35)
21:47:44.777735 IP 10.10.1.120.43028 > 172.29.4.66.domain: 33120+ TXT? _nfsv4idmapdomain. (35)
21:48:14.783096 IP 10.10.1.120.45550 > 172.29.4.66.domain: 30309+ TXT? _nfsv4idmapdomain. (35)
21:48:14.785476 IP 10.10.1.120.64751 > 172.29.4.66.domain: 30309+ TXT? _nfsv4idmapdomain. (35)
21:48:44.787807 IP 10.10.1.120.53994 > 172.29.4.66.domain: 49049+ TXT? _nfsv4idmapdomain. (35)
21:48:44.789888 IP 10.10.1.120.61817 > 172.29.4.66.domain: 49049+ TXT? _nfsv4idmapdomain. (35)
21:48:54.685575 IP 10.10.1.120.48078 > 172.29.4.66.domain: 1+ A? www.mimicdns.com. (34)
21:48:54.685721 IP 10.10.1.120.48078 > 172.29.4.66.domain: 2+ A? host.domain. (29)
21:48:54.686107 IP 10.10.1.120.48078 > 172.29.4.66.domain: 3+ A? www.mimicdns.com. (34)
21:48:54.686230 IP 10.10.1.120.48078 > 172.29.4.66.domain: 4+ A? host.domain. (29)
21:48:54.686265 IP 10.10.1.120.48078 > 172.29.4.66.domain: 5+ A? www.mimicdns.com. (34)
21:48:54.686350 IP 10.10.1.120.48078 > 172.29.4.66.domain: 6+ A? host.domain. (29)
21:48:54.686448 IP 10.10.1.120.48078 > 172.29.4.66.domain: 7+ A? www.mimicdns.com. (34)
21:48:54.686556 IP 10.10.1.120.48078 > 172.29.4.66.domain: 8+ A? host.domain. (29)
21:48:54.686593 IP 10.10.1.120.48078 > 172.29.4.66.domain: 9+ A? www.mimicdns.com. (34)
21:48:54.686687 IP 10.10.1.120.48078 > 172.29.4.66.domain: 10+ A? host.domain. (29)
21:48:54.686817 IP 10.10.1.120.48078 > 172.29.4.66.domain: 11+ A? www.mimicdns.com. (34)
21:48:54.687031 IP 10.10.1.120.48078 > 172.29.4.66.domain: 12+ A? host.domain. (29)
21:48:54.687274 IP 10.10.1.120.48078 > 172.29.4.66.domain: 13+ A? www.mimicdns.com. (34)
21:48:54.687526 IP 10.10.1.120.48078 > 172.29.4.66.domain: 14+ A? host.domain. (29)
21:48:54.687799 IP 10.10.1.120.48078 > 172.29.4.66.domain: 15+ A? www.mimicdns.com. (34)
21:48:54.687972 IP 10.10.1.120.48078 > 172.29.4.66.domain: 16+ A? host.domain. (29)
21:48:54.688086 IP 10.10.1.120.48078 > 172.29.4.66.domain: 17+ A? www.mimicdns.com. (34)
21:48:54.688175 IP 10.10.1.120.48078 > 172.29.4.66.domain: 18+ A? host.domain. (29)
21:48:54.688257 IP 10.10.1.120.48078 > 172.29.4.66.domain: 19+ A? www.mimicdns.com. (34)
21:48:54.688258 IP 10.10.1.120.48078 > 172.29.4.66.domain: 20+ A? host.domain. (29)
21:48:56.689256 IP 10.10.1.120.48078 > 172.29.4.66.domain: 21+ A? www.mimicdns.com. (34)
21:48:56.689348 IP 10.10.1.120.48078 > 172.29.4.66.domain: 22+ A? host.domain. (29)
21:48:56.689384 IP 10.10.1.120.48078 > 172.29.4.66.domain: 23+ A? www.mimicdns.com. (34)
21:48:56.689469 IP 10.10.1.120.48078 > 172.29.4.66.domain: 24+ A? host.domain. (29)
21:48:56.689529 IP 10.10.1.120.48078 > 172.29.4.66.domain: 25+ A? www.mimicdns.com. (34)
21:48:56.689594 IP 10.10.1.120.48078 > 172.29.4.66.domain: 26+ A? host.domain. (29)
21:48:56.689657 IP 10.10.1.120.48078 > 172.29.4.66.domain: 27+ A? www.mimicdns.com. (34)
21:48:56.689721 IP 10.10.1.120.48078 > 172.29.4.66.domain: 28+ A? host.domain. (29)
21:48:56.689802 IP 10.10.1.120.48078 > 172.29.4.66.domain: 29+ A? www.mimicdns.com. (34)
21:48:56.689913 IP 10.10.1.120.48078 > 172.29.4.66.domain: 30+ A? host.domain. (29)
21:48:56.689981 IP 10.10.1.120.48078 > 172.29.4.66.domain: 31+ A? www.mimicdns.com. (34)
21:48:56.690014 IP 10.10.1.120.48078 > 172.29.4.66.domain: 32+ A? host.domain. (29)
21:48:56.690096 IP 10.10.1.120.48078 > 172.29.4.66.domain: 33+ A? www.mimicdns.com. (34)
21:48:56.690295 IP 10.10.1.120.48078 > 172.29.4.66.domain: 34+ A? host.domain. (29)
21:48:56.690409 IP 10.10.1.120.48078 > 172.29.4.66.domain: 35+ A? www.mimicdns.com. (34)
21:48:56.690474 IP 10.10.1.120.48078 > 172.29.4.66.domain: 36+ A? host.domain. (29)
21:48:56.690508 IP 10.10.1.120.48078 > 172.29.4.66.domain: 37+ A? www.mimicdns.com. (34)
21:48:56.690588 IP 10.10.1.120.48078 > 172.29.4.66.domain: 38+ A? host.domain. (29)
21:48:56.690651 IP 10.10.1.120.48078 > 172.29.4.66.domain: 39+ A? www.mimicdns.com. (34)
21:48:56.690713 IP 10.10.1.120.48078 > 172.29.4.66.domain: 40+ A? host.domain. (29)
21:48:58.689108 IP 10.10.1.120.48078 > 172.29.4.66.domain: 41+ A? www.mimicdns.com. (34)
21:48:58.689290 IP 10.10.1.120.48078 > 172.29.4.66.domain: 42+ A? host.domain. (29)
21:48:58.689416 IP 10.10.1.120.48078 > 172.29.4.66.domain: 43+ A? www.mimicdns.com. (34)
21:48:58.689641 IP 10.10.1.120.48078 > 172.29.4.66.domain: 44+ A? host.domain. (29)
21:48:58.689817 IP 10.10.1.120.48078 > 172.29.4.66.domain: 45+ A? www.mimicdns.com. (34)
21:48:58.689988 IP 10.10.1.120.48078 > 172.29.4.66.domain: 46+ A? host.domain. (29)
21:48:58.690103 IP 10.10.1.120.48078 > 172.29.4.66.domain: 47+ A? www.mimicdns.com. (34)
21:48:58.690222 IP 10.10.1.120.48078 > 172.29.4.66.domain: 48+ A? host.domain. (29)
21:48:58.690223 IP 10.10.1.120.48078 > 172.29.4.66.domain: 49+ A? www.mimicdns.com. (34)
21:48:58.690321 IP 10.10.1.120.48078 > 172.29.4.66.domain: 50+ A? host.domain. (29)
21:48:58.690450 IP 10.10.1.120.48078 > 172.29.4.66.domain: 51+ A? www.mimicdns.com. (34)
21:48:58.690526 IP 10.10.1.120.48078 > 172.29.4.66.domain: 52+ A? host.domain. (29)
21:48:58.690622 IP 10.10.1.120.48078 > 172.29.4.66.domain: 53+ A? www.mimicdns.com. (34)
21:48:58.690623 IP 10.10.1.120.48078 > 172.29.4.66.domain: 54+ A? host.domain. (29)
21:48:58.690719 IP 10.10.1.120.48078 > 172.29.4.66.domain: 55+ A? www.mimicdns.com. (34)
21:48:58.690796 IP 10.10.1.120.48078 > 172.29.4.66.domain: 56+ A? host.domain. (29)
21:48:58.690833 IP 10.10.1.120.48078 > 172.29.4.66.domain: 57+ A? www.mimicdns.com. (34)
21:48:58.690911 IP 10.10.1.120.48078 > 172.29.4.66.domain: 58+ A? host.domain. (29)
21:48:58.691039 IP 10.10.1.120.48078 > 172.29.4.66.domain: 59+ A? www.mimicdns.com. (34)
21:48:58.691102 IP 10.10.1.120.48078 > 172.29.4.66.domain: 60+ A? host.domain. (29)
21:49:00.686827 IP 10.10.1.120.48078 > 172.29.4.66.domain: 61+ A? www.mimicdns.com. (34)
21:49:00.687028 IP 10.10.1.120.48078 > 172.29.4.66.domain: 62+ A? host.domain. (29)
21:49:00.687365 IP 10.10.1.120.48078 > 172.29.4.66.domain: 63+ A? www.mimicdns.com. (34)
21:49:00.687477 IP 10.10.1.120.48078 > 172.29.4.66.domain: 64+ A? host.domain. (29)
21:49:00.687667 IP 10.10.1.120.48078 > 172.29.4.66.domain: 65+ A? www.mimicdns.com. (34)
21:49:00.687780 IP 10.10.1.120.48078 > 172.29.4.66.domain: 66+ A? host.domain. (29)
21:49:00.687898 IP 10.10.1.120.48078 > 172.29.4.66.domain: 67+ A? www.mimicdns.com. (34)
21:49:00.688098 IP 10.10.1.120.48078 > 172.29.4.66.domain: 68+ A? host.domain. (29)
21:49:00.688133 IP 10.10.1.120.48078 > 172.29.4.66.domain: 69+ A? www.mimicdns.com. (34)
21:49:00.688274 IP 10.10.1.120.48078 > 172.29.4.66.domain: 70+ A? host.domain. (29)
21:49:00.688388 IP 10.10.1.120.48078 > 172.29.4.66.domain: 71+ A? www.mimicdns.com. (34)
21:49:00.688452 IP 10.10.1.120.48078 > 172.29.4.66.domain: 72+ A? host.domain. (29)
21:49:00.688661 IP 10.10.1.120.48078 > 172.29.4.66.domain: 73+ A? www.mimicdns.com. (34)
21:49:00.688774 IP 10.10.1.120.48078 > 172.29.4.66.domain: 74+ A? host.domain. (29)
21:49:00.688889 IP 10.10.1.120.48078 > 172.29.4.66.domain: 75+ A? www.mimicdns.com. (34)
21:49:00.689014 IP 10.10.1.120.48078 > 172.29.4.66.domain: 76+ A? host.domain. (29)
21:49:00.689131 IP 10.10.1.120.48078 > 172.29.4.66.domain: 77+ A? www.mimicdns.com. (34)
21:49:00.689191 IP 10.10.1.120.48078 > 172.29.4.66.domain: 78+ A? host.domain. (29)
21:49:00.689446 IP 10.10.1.120.48078 > 172.29.4.66.domain: 79+ A? www.mimicdns.com. (34)
21:49:00.689447 IP 10.10.1.120.48078 > 172.29.4.66.domain: 80+ A? host.domain. (29)
21:49:02.688800 IP 10.10.1.120.48078 > 172.29.4.66.domain: 81+ A? www.mimicdns.com. (34)
21:49:02.688961 IP 10.10.1.120.48078 > 172.29.4.66.domain: 82+ A? host.domain. (29)
21:49:02.689287 IP 10.10.1.120.48078 > 172.29.4.66.domain: 83+ A? www.mimicdns.com. (34)
21:49:02.689416 IP 10.10.1.120.48078 > 172.29.4.66.domain: 84+ A? host.domain. (29)
21:49:02.689784 IP 10.10.1.120.48078 > 172.29.4.66.domain: 85+ A? www.mimicdns.com. (34)
21:49:02.689785 IP 10.10.1.120.48078 > 172.29.4.66.domain: 86+ A? host.domain. (29)
21:49:02.689890 IP 10.10.1.120.48078 > 172.29.4.66.domain: 87+ A? www.mimicdns.com. (34)
21:49:02.690015 IP 10.10.1.120.48078 > 172.29.4.66.domain: 88+ A? host.domain. (29)
21:49:02.690129 IP 10.10.1.120.48078 > 172.29.4.66.domain: 89+ A? www.mimicdns.com. (34)
21:49:02.690189 IP 10.10.1.120.48078 > 172.29.4.66.domain: 90+ A? host.domain. (29)
21:49:02.690277 IP 10.10.1.120.48078 > 172.29.4.66.domain: 91+ A? www.mimicdns.com. (34)
21:49:02.690390 IP 10.10.1.120.48078 > 172.29.4.66.domain: 92+ A? host.domain. (29)
21:49:02.690647 IP 10.10.1.120.48078 > 172.29.4.66.domain: 93+ A? www.mimicdns.com. (34)
21:49:02.690680 IP 10.10.1.120.48078 > 172.29.4.66.domain: 94+ A? host.domain. (29)
21:49:02.690757 IP 10.10.1.120.48078 > 172.29.4.66.domain: 95+ A? www.mimicdns.com. (34)
21:49:02.690825 IP 10.10.1.120.48078 > 172.29.4.66.domain: 96+ A? host.domain. (29)
21:49:02.690888 IP 10.10.1.120.48078 > 172.29.4.66.domain: 97+ A? www.mimicdns.com. (34)
21:49:02.691189 IP 10.10.1.120.48078 > 172.29.4.66.domain: 98+ A? host.domain. (29)
21:49:02.691190 IP 10.10.1.120.48078 > 172.29.4.66.domain: 99+ A? www.mimicdns.com. (34)
21:49:02.691315 IP 10.10.1.120.48078 > 172.29.4.66.domain: 100+ A? host.domain. (29)
21:49:04.686519 IP 10.10.1.120.48078 > 172.29.4.66.domain: 101+ A? www.mimicdns.com. (34)
21:49:04.686667 IP 10.10.1.120.48078 > 172.29.4.66.domain: 102+ A? host.domain. (29)
21:49:04.686782 IP 10.10.1.120.48078 > 172.29.4.66.domain: 103+ A? www.mimicdns.com. (34)
21:49:04.686912 IP 10.10.1.120.48078 > 172.29.4.66.domain: 104+ A? host.domain. (29)
21:49:04.687187 IP 10.10.1.120.48078 > 172.29.4.66.domain: 105+ A? www.mimicdns.com. (34)
21:49:04.687298 IP 10.10.1.120.48078 > 172.29.4.66.domain: 106+ A? host.domain. (29)
21:49:04.687379 IP 10.10.1.120.48078 > 172.29.4.66.domain: 107+ A? www.mimicdns.com. (34)
21:49:04.687449 IP 10.10.1.120.48078 > 172.29.4.66.domain: 108+ A? host.domain. (29)
21:49:04.687564 IP 10.10.1.120.48078 > 172.29.4.66.domain: 109+ A? www.mimicdns.com. (34)
21:49:04.687675 IP 10.10.1.120.48078 > 172.29.4.66.domain: 110+ A? host.domain. (29)
21:49:04.687791 IP 10.10.1.120.48078 > 172.29.4.66.domain: 111+ A? www.mimicdns.com. (34)
21:49:04.687903 IP 10.10.1.120.48078 > 172.29.4.66.domain: 112+ A? host.domain. (29)
21:49:04.688017 IP 10.10.1.120.48078 > 172.29.4.66.domain: 113+ A? www.mimicdns.com. (34)
21:49:04.688099 IP 10.10.1.120.48078 > 172.29.4.66.domain: 114+ A? host.domain. (29)
21:49:04.688188 IP 10.10.1.120.48078 > 172.29.4.66.domain: 115+ A? www.mimicdns.com. (34)
21:49:04.688253 IP 10.10.1.120.48078 > 172.29.4.66.domain: 116+ A? host.domain. (29)
21:49:04.688367 IP 10.10.1.120.48078 > 172.29.4.66.domain: 117+ A? www.mimicdns.com. (34)
21:49:04.688479 IP 10.10.1.120.48078 > 172.29.4.66.domain: 118+ A? host.domain. (29)
21:49:04.688583 IP 10.10.1.120.48078 > 172.29.4.66.domain: 119+ A? www.mimicdns.com. (34)
21:49:04.688649 IP 10.10.1.120.48078 > 172.29.4.66.domain: 120+ A? host.domain. (29)
21:49:06.688485 IP 10.10.1.120.48078 > 172.29.4.66.domain: 121+ A? www.mimicdns.com. (34)
21:49:06.688631 IP 10.10.1.120.48078 > 172.29.4.66.domain: 122+ A? host.domain. (29)
21:49:06.688722 IP 10.10.1.120.48078 > 172.29.4.66.domain: 123+ A? www.mimicdns.com. (34)
21:49:06.688852 IP 10.10.1.120.48078 > 172.29.4.66.domain: 124+ A? host.domain. (29)
21:49:06.689100 IP 10.10.1.120.48078 > 172.29.4.66.domain: 125+ A? www.mimicdns.com. (34)
21:49:06.689211 IP 10.10.1.120.48078 > 172.29.4.66.domain: 126+ A? host.domain. (29)
21:49:06.689317 IP 10.10.1.120.48078 > 172.29.4.66.domain: 127+ A? www.mimicdns.com. (34)
21:49:06.689446 IP 10.10.1.120.48078 > 172.29.4.66.domain: 128+ A? host.domain. (29)
21:49:06.689447 IP 10.10.1.120.48078 > 172.29.4.66.domain: 129+ A? www.mimicdns.com. (34)
21:49:06.689543 IP 10.10.1.120.48078 > 172.29.4.66.domain: 130+ A? host.domain. (29)
21:49:06.689641 IP 10.10.1.120.48078 > 172.29.4.66.domain: 131+ A? www.mimicdns.com. (34)
21:49:06.689744 IP 10.10.1.120.48078 > 172.29.4.66.domain: 132+ A? host.domain. (29)
21:49:06.689833 IP 10.10.1.120.48078 > 172.29.4.66.domain: 133+ A? www.mimicdns.com. (34)
21:49:06.689933 IP 10.10.1.120.48078 > 172.29.4.66.domain: 134+ A? host.domain. (29)
21:49:06.690011 IP 10.10.1.120.48078 > 172.29.4.66.domain: 135+ A? www.mimicdns.com. (34)
21:49:06.690083 IP 10.10.1.120.48078 > 172.29.4.66.domain: 136+ A? host.domain. (29)
21:49:06.690196 IP 10.10.1.120.48078 > 172.29.4.66.domain: 137+ A? www.mimicdns.com. (34)
21:49:06.690293 IP 10.10.1.120.48078 > 172.29.4.66.domain: 138+ A? host.domain. (29)
21:49:06.690407 IP 10.10.1.120.48078 > 172.29.4.66.domain: 139+ A? www.mimicdns.com. (34)
21:49:06.690507 IP 10.10.1.120.48078 > 172.29.4.66.domain: 140+ A? host.domain. (29)
21:49:08.686204 IP 10.10.1.120.48078 > 172.29.4.66.domain: 141+ A? www.mimicdns.com. (34)
21:49:08.686361 IP 10.10.1.120.48078 > 172.29.4.66.domain: 142+ A? host.domain. (29)
21:49:08.686472 IP 10.10.1.120.48078 > 172.29.4.66.domain: 143+ A? www.mimicdns.com. (34)
21:49:08.686748 IP 10.10.1.120.48078 > 172.29.4.66.domain: 144+ A? host.domain. (29)
21:49:08.686940 IP 10.10.1.120.48078 > 172.29.4.66.domain: 145+ A? www.mimicdns.com. (34)
21:49:08.687058 IP 10.10.1.120.48078 > 172.29.4.66.domain: 146+ A? host.domain. (29)
21:49:08.687233 IP 10.10.1.120.48078 > 172.29.4.66.domain: 147+ A? www.mimicdns.com. (34)
21:49:08.687342 IP 10.10.1.120.48078 > 172.29.4.66.domain: 148+ A? host.domain. (29)
21:49:08.687423 IP 10.10.1.120.48078 > 172.29.4.66.domain: 149+ A? www.mimicdns.com. (34)
21:49:08.687491 IP 10.10.1.120.48078 > 172.29.4.66.domain: 150+ A? host.domain. (29)
21:49:08.687529 IP 10.10.1.120.48078 > 172.29.4.66.domain: 151+ A? www.mimicdns.com. (34)
21:49:08.687668 IP 10.10.1.120.48078 > 172.29.4.66.domain: 152+ A? host.domain. (29)
21:49:08.687794 IP 10.10.1.120.48078 > 172.29.4.66.domain: 153+ A? www.mimicdns.com. (34)
21:49:08.687795 IP 10.10.1.120.48078 > 172.29.4.66.domain: 154+ A? host.domain. (29)
21:49:08.687913 IP 10.10.1.120.48078 > 172.29.4.66.domain: 155+ A? www.mimicdns.com. (34)
21:49:08.688024 IP 10.10.1.120.48078 > 172.29.4.66.domain: 156+ A? host.domain. (29)
21:49:08.688115 IP 10.10.1.120.48078 > 172.29.4.66.domain: 157+ A? www.mimicdns.com. (34)
21:49:08.688174 IP 10.10.1.120.48078 > 172.29.4.66.domain: 158+ A? host.domain. (29)
21:49:08.688294 IP 10.10.1.120.48078 > 172.29.4.66.domain: 159+ A? www.mimicdns.com. (34)
21:49:08.688398 IP 10.10.1.120.48078 > 172.29.4.66.domain: 160+ A? host.domain. (29)
21:49:10.687763 IP 10.10.1.120.48078 > 172.29.4.66.domain: 161+ A? www.mimicdns.com. (34)
21:49:10.687910 IP 10.10.1.120.48078 > 172.29.4.66.domain: 162+ A? host.domain. (29)
21:49:10.688008 IP 10.10.1.120.48078 > 172.29.4.66.domain: 163+ A? www.mimicdns.com. (34)
21:49:10.688184 IP 10.10.1.120.48078 > 172.29.4.66.domain: 164+ A? host.domain. (29)
21:49:10.688299 IP 10.10.1.120.48078 > 172.29.4.66.domain: 165+ A? www.mimicdns.com. (34)
21:49:10.688476 IP 10.10.1.120.48078 > 172.29.4.66.domain: 166+ A? host.domain. (29)
21:49:10.688582 IP 10.10.1.120.48078 > 172.29.4.66.domain: 167+ A? www.mimicdns.com. (34)
21:49:10.688583 IP 10.10.1.120.48078 > 172.29.4.66.domain: 168+ A? host.domain. (29)
21:49:10.688688 IP 10.10.1.120.48078 > 172.29.4.66.domain: 169+ A? www.mimicdns.com. (34)
21:49:10.688798 IP 10.10.1.120.48078 > 172.29.4.66.domain: 170+ A? host.domain. (29)
21:49:10.688879 IP 10.10.1.120.48078 > 172.29.4.66.domain: 171+ A? www.mimicdns.com. (34)
21:49:10.688939 IP 10.10.1.120.48078 > 172.29.4.66.domain: 172+ A? host.domain. (29)
21:49:10.688974 IP 10.10.1.120.48078 > 172.29.4.66.domain: 173+ A? www.mimicdns.com. (34)
21:49:10.689010 IP 10.10.1.120.48078 > 172.29.4.66.domain: 174+ A? host.domain. (29)
21:49:10.689153 IP 10.10.1.120.48078 > 172.29.4.66.domain: 175+ A? www.mimicdns.com. (34)
21:49:10.689233 IP 10.10.1.120.48078 > 172.29.4.66.domain: 176+ A? host.domain. (29)
21:49:10.689347 IP 10.10.1.120.48078 > 172.29.4.66.domain: 177+ A? www.mimicdns.com. (34)
21:49:10.689432 IP 10.10.1.120.48078 > 172.29.4.66.domain: 178+ A? host.domain. (29)
21:49:10.689547 IP 10.10.1.120.48078 > 172.29.4.66.domain: 179+ A? www.mimicdns.com. (34)
21:49:10.689641 IP 10.10.1.120.48078 > 172.29.4.66.domain: 180+ A? host.domain. (29)
21:49:12.686859 IP 10.10.1.120.48078 > 172.29.4.66.domain: 181+ A? www.mimicdns.com. (34)
21:49:12.687011 IP 10.10.1.120.48078 > 172.29.4.66.domain: 182+ A? host.domain. (29)
21:49:12.687224 IP 10.10.1.120.48078 > 172.29.4.66.domain: 183+ A? www.mimicdns.com. (34)
21:49:12.687418 IP 10.10.1.120.48078 > 172.29.4.66.domain: 184+ A? host.domain. (29)
21:49:12.687632 IP 10.10.1.120.48078 > 172.29.4.66.domain: 185+ A? www.mimicdns.com. (34)
21:49:12.687744 IP 10.10.1.120.48078 > 172.29.4.66.domain: 186+ A? host.domain. (29)
21:49:12.687858 IP 10.10.1.120.48078 > 172.29.4.66.domain: 187+ A? www.mimicdns.com. (34)
21:49:12.687917 IP 10.10.1.120.48078 > 172.29.4.66.domain: 188+ A? host.domain. (29)
21:49:12.688014 IP 10.10.1.120.48078 > 172.29.4.66.domain: 189+ A? www.mimicdns.com. (34)
21:49:12.688126 IP 10.10.1.120.48078 > 172.29.4.66.domain: 190+ A? host.domain. (29)
21:49:12.688207 IP 10.10.1.120.48078 > 172.29.4.66.domain: 191+ A? www.mimicdns.com. (34)
21:49:12.688275 IP 10.10.1.120.48078 > 172.29.4.66.domain: 192+ A? host.domain. (29)
21:49:12.688390 IP 10.10.1.120.48078 > 172.29.4.66.domain: 193+ A? www.mimicdns.com. (34)
21:49:12.688469 IP 10.10.1.120.48078 > 172.29.4.66.domain: 194+ A? host.domain. (29)
21:49:12.688532 IP 10.10.1.120.48078 > 172.29.4.66.domain: 195+ A? www.mimicdns.com. (34)
21:49:12.688646 IP 10.10.1.120.48078 > 172.29.4.66.domain: 196+ A? host.domain. (29)
21:49:12.688851 IP 10.10.1.120.48078 > 172.29.4.66.domain: 197+ A? www.mimicdns.com. (34)
21:49:12.688886 IP 10.10.1.120.48078 > 172.29.4.66.domain: 198+ A? host.domain. (29)
21:49:12.688965 IP 10.10.1.120.48078 > 172.29.4.66.domain: 199+ A? www.mimicdns.com. (34)
21:49:12.689028 IP 10.10.1.120.48078 > 172.29.4.66.domain: 200+ A? host.domain. (29)
21:49:14.689409 IP 10.10.1.120.48078 > 172.29.4.66.domain: 201+ A? www.mimicdns.com. (34)
21:49:14.689495 IP 10.10.1.120.48078 > 172.29.4.66.domain: 202+ A? host.domain. (29)
21:49:14.689529 IP 10.10.1.120.48078 > 172.29.4.66.domain: 203+ A? www.mimicdns.com. (34)
21:49:14.689634 IP 10.10.1.120.48078 > 172.29.4.66.domain: 204+ A? host.domain. (29)
21:49:14.689749 IP 10.10.1.120.48078 > 172.29.4.66.domain: 205+ A? www.mimicdns.com. (34)
21:49:14.689815 IP 10.10.1.120.48078 > 172.29.4.66.domain: 206+ A? host.domain. (29)
21:49:14.689849 IP 10.10.1.120.48078 > 172.29.4.66.domain: 207+ A? www.mimicdns.com. (34)
21:49:14.689929 IP 10.10.1.120.48078 > 172.29.4.66.domain: 208+ A? host.domain. (29)
21:49:14.689992 IP 10.10.1.120.48078 > 172.29.4.66.domain: 209+ A? www.mimicdns.com. (34)
21:49:14.690068 IP 10.10.1.120.48078 > 172.29.4.66.domain: 210+ A? host.domain. (29)
21:49:14.690187 IP 10.10.1.120.48078 > 172.29.4.66.domain: 211+ A? www.mimicdns.com. (34)
21:49:14.690299 IP 10.10.1.120.48078 > 172.29.4.66.domain: 212+ A? host.domain. (29)
21:49:14.690390 IP 10.10.1.120.48078 > 172.29.4.66.domain: 213+ A? www.mimicdns.com. (34)
21:49:14.690474 IP 10.10.1.120.48078 > 172.29.4.66.domain: 214+ A? host.domain. (29)
21:49:14.690567 IP 10.10.1.120.48078 > 172.29.4.66.domain: 215+ A? www.mimicdns.com. (34)
21:49:14.690568 IP 10.10.1.120.48078 > 172.29.4.66.domain: 216+ A? host.domain. (29)
21:49:14.690668 IP 10.10.1.120.48078 > 172.29.4.66.domain: 217+ A? www.mimicdns.com. (34)
21:49:14.690669 IP 10.10.1.120.48078 > 172.29.4.66.domain: 218+ A? host.domain. (29)
21:49:14.690793 IP 10.10.1.120.48078 > 172.29.4.66.domain: 219+ A? www.mimicdns.com. (34)
21:49:14.690794 IP 10.10.1.120.48078 > 172.29.4.66.domain: 220+ A? host.domain. (29)
21:49:14.795355 IP 10.10.1.120.57451 > 172.29.4.66.domain: 25022+ TXT? _nfsv4idmapdomain. (35)
21:49:14.797536 IP 10.10.1.120.34435 > 172.29.4.66.domain: 25022+ TXT? _nfsv4idmapdomain. (35)
21:49:20.464534 IP 10.10.1.120.49321 > 172.29.4.66.domain: 1+ A? www.mimicdns.com. (34)
21:49:20.464687 IP 10.10.1.120.49321 > 172.29.4.66.domain: 2+ A? host.domain. (29)
21:49:20.464768 IP 10.10.1.120.49321 > 172.29.4.66.domain: 3+ A? www.mimicdns.com. (34)
21:49:20.464837 IP 10.10.1.120.49321 > 172.29.4.66.domain: 4+ A? host.domain. (29)
21:49:20.465119 IP 10.10.1.120.49321 > 172.29.4.66.domain: 5+ A? www.mimicdns.com. (34)
21:49:20.465120 IP 10.10.1.120.49321 > 172.29.4.66.domain: 6+ A? host.domain. (29)
21:49:20.465240 IP 10.10.1.120.49321 > 172.29.4.66.domain: 7+ A? www.mimicdns.com. (34)
21:49:20.465351 IP 10.10.1.120.49321 > 172.29.4.66.domain: 8+ A? host.domain. (29)
21:49:20.465526 IP 10.10.1.120.49321 > 172.29.4.66.domain: 9+ A? www.mimicdns.com. (34)
21:49:20.465626 IP 10.10.1.120.49321 > 172.29.4.66.domain: 10+ A? host.domain. (29)
21:49:20.465730 IP 10.10.1.120.49321 > 172.29.4.66.domain: 11+ A? www.mimicdns.com. (34)
21:49:20.465852 IP 10.10.1.120.49321 > 172.29.4.66.domain: 12+ A? host.domain. (29)
21:49:20.466106 IP 10.10.1.120.49321 > 172.29.4.66.domain: 13+ A? www.mimicdns.com. (34)
21:49:20.466222 IP 10.10.1.120.49321 > 172.29.4.66.domain: 14+ A? host.domain. (29)
21:49:20.466519 IP 10.10.1.120.49321 > 172.29.4.66.domain: 15+ A? www.mimicdns.com. (34)
21:49:20.466632 IP 10.10.1.120.49321 > 172.29.4.66.domain: 16+ A? host.domain. (29)
21:49:20.466812 IP 10.10.1.120.49321 > 172.29.4.66.domain: 17+ A? www.mimicdns.com. (34)
21:49:20.466844 IP 10.10.1.120.49321 > 172.29.4.66.domain: 18+ A? host.domain. (29)
21:49:20.466925 IP 10.10.1.120.49321 > 172.29.4.66.domain: 19+ A? www.mimicdns.com. (34)
21:49:20.466987 IP 10.10.1.120.49321 > 172.29.4.66.domain: 20+ A? host.domain. (29)
21:49:40.468144 IP 10.10.1.120.49321 > 172.29.4.66.domain: 21+ A? www.mimicdns.com. (34)
21:49:40.468287 IP 10.10.1.120.49321 > 172.29.4.66.domain: 22+ A? host.domain. (29)
21:49:40.468383 IP 10.10.1.120.49321 > 172.29.4.66.domain: 23+ A? www.mimicdns.com. (34)
21:49:40.468495 IP 10.10.1.120.49321 > 172.29.4.66.domain: 24+ A? host.domain. (29)
21:49:40.468607 IP 10.10.1.120.49321 > 172.29.4.66.domain: 25+ A? www.mimicdns.com. (34)
21:49:40.468786 IP 10.10.1.120.49321 > 172.29.4.66.domain: 26+ A? host.domain. (29)
21:49:40.468905 IP 10.10.1.120.49321 > 172.29.4.66.domain: 27+ A? www.mimicdns.com. (34)
21:49:40.468995 IP 10.10.1.120.49321 > 172.29.4.66.domain: 28+ A? host.domain. (29)
21:49:40.469090 IP 10.10.1.120.49321 > 172.29.4.66.domain: 29+ A? www.mimicdns.com. (34)
21:49:40.469174 IP 10.10.1.120.49321 > 172.29.4.66.domain: 30+ A? host.domain. (29)
21:49:40.469246 IP 10.10.1.120.49321 > 172.29.4.66.domain: 31+ A? www.mimicdns.com. (34)
21:49:40.469313 IP 10.10.1.120.49321 > 172.29.4.66.domain: 32+ A? host.domain. (29)
21:49:40.469408 IP 10.10.1.120.49321 > 172.29.4.66.domain: 33+ A? www.mimicdns.com. (34)
21:49:40.469522 IP 10.10.1.120.49321 > 172.29.4.66.domain: 34+ A? host.domain. (29)
21:49:40.469633 IP 10.10.1.120.49321 > 172.29.4.66.domain: 35+ A? www.mimicdns.com. (34)
21:49:40.469741 IP 10.10.1.120.49321 > 172.29.4.66.domain: 36+ A? host.domain. (29)
21:49:40.469743 IP 10.10.1.120.49321 > 172.29.4.66.domain: 37+ A? www.mimicdns.com. (34)
21:49:40.469840 IP 10.10.1.120.49321 > 172.29.4.66.domain: 38+ A? host.domain. (29)
21:49:40.469962 IP 10.10.1.120.49321 > 172.29.4.66.domain: 39+ A? www.mimicdns.com. (34)
21:49:40.470056 IP 10.10.1.120.49321 > 172.29.4.66.domain: 40+ A? host.domain. (29)
21:49:44.801053 IP 10.10.1.120.56707 > 172.29.4.66.domain: 40215+ TXT? _nfsv4idmapdomain. (35)
21:49:44.804097 IP 10.10.1.120.36731 > 172.29.4.66.domain: 40215+ TXT? _nfsv4idmapdomain. (35)
21:50:00.467951 IP 10.10.1.120.49321 > 172.29.4.66.domain: 41+ A? www.mimicdns.com. (34)
21:50:00.468098 IP 10.10.1.120.49321 > 172.29.4.66.domain: 42+ A? host.domain. (29)
21:50:00.468209 IP 10.10.1.120.49321 > 172.29.4.66.domain: 43+ A? www.mimicdns.com. (34)
21:50:00.468343 IP 10.10.1.120.49321 > 172.29.4.66.domain: 44+ A? host.domain. (29)
21:50:00.468452 IP 10.10.1.120.49321 > 172.29.4.66.domain: 45+ A? www.mimicdns.com. (34)
21:50:00.468577 IP 10.10.1.120.49321 > 172.29.4.66.domain: 46+ A? host.domain. (29)
21:50:00.468689 IP 10.10.1.120.49321 > 172.29.4.66.domain: 47+ A? www.mimicdns.com. (34)
21:50:00.468794 IP 10.10.1.120.49321 > 172.29.4.66.domain: 48+ A? host.domain. (29)
21:50:00.468859 IP 10.10.1.120.49321 > 172.29.4.66.domain: 49+ A? www.mimicdns.com. (34)
21:50:00.468963 IP 10.10.1.120.49321 > 172.29.4.66.domain: 50+ A? host.domain. (29)
21:50:00.469078 IP 10.10.1.120.49321 > 172.29.4.66.domain: 51+ A? www.mimicdns.com. (34)
21:50:00.469166 IP 10.10.1.120.49321 > 172.29.4.66.domain: 52+ A? host.domain. (29)
21:50:00.469280 IP 10.10.1.120.49321 > 172.29.4.66.domain: 53+ A? www.mimicdns.com. (34)
21:50:00.469393 IP 10.10.1.120.49321 > 172.29.4.66.domain: 54+ A? host.domain. (29)
21:50:00.469506 IP 10.10.1.120.49321 > 172.29.4.66.domain: 55+ A? www.mimicdns.com. (34)
21:50:00.469611 IP 10.10.1.120.49321 > 172.29.4.66.domain: 56+ A? host.domain. (29)
21:50:00.469715 IP 10.10.1.120.49321 > 172.29.4.66.domain: 57+ A? www.mimicdns.com. (34)
21:50:00.469801 IP 10.10.1.120.49321 > 172.29.4.66.domain: 58+ A? host.domain. (29)
21:50:00.469915 IP 10.10.1.120.49321 > 172.29.4.66.domain: 59+ A? www.mimicdns.com. (34)
21:50:00.470027 IP 10.10.1.120.49321 > 172.29.4.66.domain: 60+ A? host.domain. (29)
21:50:14.807376 IP 10.10.1.120.55834 > 172.29.4.66.domain: 34385+ TXT? _nfsv4idmapdomain. (35)
21:50:14.810562 IP 10.10.1.120.36388 > 172.29.4.66.domain: 34385+ TXT? _nfsv4idmapdomain. (35)
21:50:20.466145 IP 10.10.1.120.49321 > 172.29.4.66.domain: 61+ A? www.mimicdns.com. (34)
21:50:20.466305 IP 10.10.1.120.49321 > 172.29.4.66.domain: 62+ A? host.domain. (29)
21:50:20.466416 IP 10.10.1.120.49321 > 172.29.4.66.domain: 63+ A? www.mimicdns.com. (34)
21:50:20.466698 IP 10.10.1.120.49321 > 172.29.4.66.domain: 64+ A? host.domain. (29)
21:50:20.466884 IP 10.10.1.120.49321 > 172.29.4.66.domain: 65+ A? www.mimicdns.com. (34)
21:50:20.467009 IP 10.10.1.120.49321 > 172.29.4.66.domain: 66+ A? host.domain. (29)
21:50:20.467010 IP 10.10.1.120.49321 > 172.29.4.66.domain: 67+ A? www.mimicdns.com. (34)
21:50:20.467108 IP 10.10.1.120.49321 > 172.29.4.66.domain: 68+ A? host.domain. (29)
21:50:20.467185 IP 10.10.1.120.49321 > 172.29.4.66.domain: 69+ A? www.mimicdns.com. (34)
21:50:20.467300 IP 10.10.1.120.49321 > 172.29.4.66.domain: 70+ A? host.domain. (29)
21:50:20.467425 IP 10.10.1.120.49321 > 172.29.4.66.domain: 71+ A? www.mimicdns.com. (34)
21:50:20.467538 IP 10.10.1.120.49321 > 172.29.4.66.domain: 72+ A? host.domain. (29)
21:50:20.467652 IP 10.10.1.120.49321 > 172.29.4.66.domain: 73+ A? www.mimicdns.com. (34)
21:50:20.467732 IP 10.10.1.120.49321 > 172.29.4.66.domain: 74+ A? host.domain. (29)
21:50:20.467839 IP 10.10.1.120.49321 > 172.29.4.66.domain: 75+ A? www.mimicdns.com. (34)
21:50:20.467904 IP 10.10.1.120.49321 > 172.29.4.66.domain: 76+ A? host.domain. (29)
21:50:20.468008 IP 10.10.1.120.49321 > 172.29.4.66.domain: 77+ A? www.mimicdns.com. (34)
21:50:20.468121 IP 10.10.1.120.49321 > 172.29.4.66.domain: 78+ A? host.domain. (29)
21:50:20.468207 IP 10.10.1.120.49321 > 172.29.4.66.domain: 79+ A? www.mimicdns.com. (34)
21:50:20.468280 IP 10.10.1.120.49321 > 172.29.4.66.domain: 80+ A? host.domain. (29)
21:50:40.467958 IP 10.10.1.120.49321 > 172.29.4.66.domain: 81+ A? www.mimicdns.com. (34)
21:50:40.468121 IP 10.10.1.120.49321 > 172.29.4.66.domain: 82+ A? host.domain. (29)
21:50:40.468299 IP 10.10.1.120.49321 > 172.29.4.66.domain: 83+ A? www.mimicdns.com. (34)
21:50:40.468419 IP 10.10.1.120.49321 > 172.29.4.66.domain: 84+ A? host.domain. (29)
21:50:40.468593 IP 10.10.1.120.49321 > 172.29.4.66.domain: 85+ A? www.mimicdns.com. (34)
21:50:40.468697 IP 10.10.1.120.49321 > 172.29.4.66.domain: 86+ A? host.domain. (29)
21:50:40.468760 IP 10.10.1.120.49321 > 172.29.4.66.domain: 87+ A? www.mimicdns.com. (34)
21:50:40.468844 IP 10.10.1.120.49321 > 172.29.4.66.domain: 88+ A? host.domain. (29)
21:50:40.468911 IP 10.10.1.120.49321 > 172.29.4.66.domain: 89+ A? www.mimicdns.com. (34)
21:50:40.468992 IP 10.10.1.120.49321 > 172.29.4.66.domain: 90+ A? host.domain. (29)
21:50:40.469070 IP 10.10.1.120.49321 > 172.29.4.66.domain: 91+ A? www.mimicdns.com. (34)
21:50:40.469098 IP 10.10.1.120.49321 > 172.29.4.66.domain: 92+ A? host.domain. (29)
21:50:40.469183 IP 10.10.1.120.49321 > 172.29.4.66.domain: 93+ A? www.mimicdns.com. (34)
21:50:40.469293 IP 10.10.1.120.49321 > 172.29.4.66.domain: 94+ A? host.domain. (29)
21:50:40.469371 IP 10.10.1.120.49321 > 172.29.4.66.domain: 95+ A? www.mimicdns.com. (34)
21:50:40.469438 IP 10.10.1.120.49321 > 172.29.4.66.domain: 96+ A? host.domain. (29)
21:50:40.469555 IP 10.10.1.120.49321 > 172.29.4.66.domain: 97+ A? www.mimicdns.com. (34)
21:50:40.469680 IP 10.10.1.120.49321 > 172.29.4.66.domain: 98+ A? host.domain. (29)
21:50:40.469805 IP 10.10.1.120.49321 > 172.29.4.66.domain: 99+ A? www.mimicdns.com. (34)
21:50:40.469807 IP 10.10.1.120.49321 > 172.29.4.66.domain: 100+ A? host.domain. (29)
21:50:44.815373 IP 10.10.1.120.51288 > 172.29.4.66.domain: 58082+ TXT? _nfsv4idmapdomain. (35)
21:50:44.818682 IP 10.10.1.120.42814 > 172.29.4.66.domain: 58082+ TXT? _nfsv4idmapdomain. (35)
21:51:00.465494 IP 10.10.1.120.49321 > 172.29.4.66.domain: 101+ A? www.mimicdns.com. (34)
21:51:00.465523 IP 10.10.1.120.49321 > 172.29.4.66.domain: 102+ A? host.domain. (29)
21:51:00.465606 IP 10.10.1.120.49321 > 172.29.4.66.domain: 103+ A? www.mimicdns.com. (34)
21:51:00.465639 IP 10.10.1.120.49321 > 172.29.4.66.domain: 104+ A? host.domain. (29)
21:51:00.465684 IP 10.10.1.120.49321 > 172.29.4.66.domain: 105+ A? www.mimicdns.com. (34)
21:51:00.465806 IP 10.10.1.120.49321 > 172.29.4.66.domain: 106+ A? host.domain. (29)
21:51:00.465919 IP 10.10.1.120.49321 > 172.29.4.66.domain: 107+ A? www.mimicdns.com. (34)
21:51:00.465977 IP 10.10.1.120.49321 > 172.29.4.66.domain: 108+ A? host.domain. (29)
21:51:00.466013 IP 10.10.1.120.49321 > 172.29.4.66.domain: 109+ A? www.mimicdns.com. (34)
21:51:00.466126 IP 10.10.1.120.49321 > 172.29.4.66.domain: 110+ A? host.domain. (29)
21:51:00.466203 IP 10.10.1.120.49321 > 172.29.4.66.domain: 111+ A? www.mimicdns.com. (34)
21:51:00.466287 IP 10.10.1.120.49321 > 172.29.4.66.domain: 112+ A? host.domain. (29)
21:51:00.466362 IP 10.10.1.120.49321 > 172.29.4.66.domain: 113+ A? www.mimicdns.com. (34)
21:51:00.466426 IP 10.10.1.120.49321 > 172.29.4.66.domain: 114+ A? host.domain. (29)
21:51:00.466538 IP 10.10.1.120.49321 > 172.29.4.66.domain: 115+ A? www.mimicdns.com. (34)
21:51:00.466539 IP 10.10.1.120.49321 > 172.29.4.66.domain: 116+ A? host.domain. (29)
21:51:00.466634 IP 10.10.1.120.49321 > 172.29.4.66.domain: 117+ A? www.mimicdns.com. (34)
21:51:00.466702 IP 10.10.1.120.49321 > 172.29.4.66.domain: 118+ A? host.domain. (29)
21:51:00.466743 IP 10.10.1.120.49321 > 172.29.4.66.domain: 119+ A? www.mimicdns.com. (34)
21:51:00.466848 IP 10.10.1.120.49321 > 172.29.4.66.domain: 120+ A? host.domain. (29)
21:51:14.823912 IP 10.10.1.120.55795 > 172.29.4.66.domain: 59156+ TXT? _nfsv4idmapdomain. (35)
21:51:14.827990 IP 10.10.1.120.54472 > 172.29.4.66.domain: 59156+ TXT? _nfsv4idmapdomain. (35)
21:51:20.467682 IP 10.10.1.120.49321 > 172.29.4.66.domain: 121+ A? www.mimicdns.com. (34)
21:51:20.467851 IP 10.10.1.120.49321 > 172.29.4.66.domain: 122+ A? host.domain. (29)
21:51:20.467951 IP 10.10.1.120.49321 > 172.29.4.66.domain: 123+ A? www.mimicdns.com. (34)
21:51:20.468100 IP 10.10.1.120.49321 > 172.29.4.66.domain: 124+ A? host.domain. (29)
21:51:20.468212 IP 10.10.1.120.49321 > 172.29.4.66.domain: 125+ A? www.mimicdns.com. (34)
21:51:20.468391 IP 10.10.1.120.49321 > 172.29.4.66.domain: 126+ A? host.domain. (29)
21:51:20.468481 IP 10.10.1.120.49321 > 172.29.4.66.domain: 127+ A? www.mimicdns.com. (34)
21:51:20.468555 IP 10.10.1.120.49321 > 172.29.4.66.domain: 128+ A? host.domain. (29)
21:51:20.468661 IP 10.10.1.120.49321 > 172.29.4.66.domain: 129+ A? www.mimicdns.com. (34)
21:51:20.468772 IP 10.10.1.120.49321 > 172.29.4.66.domain: 130+ A? host.domain. (29)
21:51:20.468806 IP 10.10.1.120.49321 > 172.29.4.66.domain: 131+ A? www.mimicdns.com. (34)
21:51:20.468843 IP 10.10.1.120.49321 > 172.29.4.66.domain: 132+ A? host.domain. (29)
21:51:20.468981 IP 10.10.1.120.49321 > 172.29.4.66.domain: 133+ A? www.mimicdns.com. (34)
21:51:20.469047 IP 10.10.1.120.49321 > 172.29.4.66.domain: 134+ A? host.domain. (29)
21:51:20.469169 IP 10.10.1.120.49321 > 172.29.4.66.domain: 135+ A? www.mimicdns.com. (34)
21:51:20.469170 IP 10.10.1.120.49321 > 172.29.4.66.domain: 136+ A? host.domain. (29)
21:51:20.469278 IP 10.10.1.120.49321 > 172.29.4.66.domain: 137+ A? www.mimicdns.com. (34)
21:51:20.469376 IP 10.10.1.120.49321 > 172.29.4.66.domain: 138+ A? host.domain. (29)
21:51:20.469404 IP 10.10.1.120.49321 > 172.29.4.66.domain: 139+ A? www.mimicdns.com. (34)
21:51:20.469521 IP 10.10.1.120.49321 > 172.29.4.66.domain: 140+ A? host.domain. (29)
21:51:40.465643 IP 10.10.1.120.49321 > 172.29.4.66.domain: 141+ A? www.mimicdns.com. (34)
21:51:40.465807 IP 10.10.1.120.49321 > 172.29.4.66.domain: 142+ A? host.domain. (29)
21:51:40.465921 IP 10.10.1.120.49321 > 172.29.4.66.domain: 143+ A? www.mimicdns.com. (34)
21:51:40.466093 IP 10.10.1.120.49321 > 172.29.4.66.domain: 144+ A? host.domain. (29)
21:51:40.466223 IP 10.10.1.120.49321 > 172.29.4.66.domain: 145+ A? www.mimicdns.com. (34)
21:51:40.466352 IP 10.10.1.120.49321 > 172.29.4.66.domain: 146+ A? host.domain. (29)
21:51:40.466466 IP 10.10.1.120.49321 > 172.29.4.66.domain: 147+ A? www.mimicdns.com. (34)
21:51:40.466578 IP 10.10.1.120.49321 > 172.29.4.66.domain: 148+ A? host.domain. (29)
21:51:40.466687 IP 10.10.1.120.49321 > 172.29.4.66.domain: 149+ A? www.mimicdns.com. (34)
21:51:40.466769 IP 10.10.1.120.49321 > 172.29.4.66.domain: 150+ A? host.domain. (29)
21:51:40.466899 IP 10.10.1.120.49321 > 172.29.4.66.domain: 151+ A? www.mimicdns.com. (34)
21:51:40.466901 IP 10.10.1.120.49321 > 172.29.4.66.domain: 152+ A? host.domain. (29)
21:51:40.467005 IP 10.10.1.120.49321 > 172.29.4.66.domain: 153+ A? www.mimicdns.com. (34)
21:51:40.467122 IP 10.10.1.120.49321 > 172.29.4.66.domain: 154+ A? host.domain. (29)
21:51:40.467295 IP 10.10.1.120.49321 > 172.29.4.66.domain: 155+ A? www.mimicdns.com. (34)
21:51:40.467400 IP 10.10.1.120.49321 > 172.29.4.66.domain: 156+ A? host.domain. (29)
21:51:40.467460 IP 10.10.1.120.49321 > 172.29.4.66.domain: 157+ A? www.mimicdns.com. (34)
21:51:40.467581 IP 10.10.1.120.49321 > 172.29.4.66.domain: 158+ A? host.domain. (29)
21:51:40.467688 IP 10.10.1.120.49321 > 172.29.4.66.domain: 159+ A? www.mimicdns.com. (34)
21:51:40.467786 IP 10.10.1.120.49321 > 172.29.4.66.domain: 160+ A? host.domain. (29)
21:51:44.832897 IP 10.10.1.120.45809 > 172.29.4.66.domain: 24032+ TXT? _nfsv4idmapdomain. (35)
21:51:44.836231 IP 10.10.1.120.35369 > 172.29.4.66.domain: 24032+ TXT? _nfsv4idmapdomain. (35)
21:52:00.464615 IP 10.10.1.120.49321 > 172.29.4.66.domain: 161+ A? www.mimicdns.com. (34)
21:52:00.464797 IP 10.10.1.120.49321 > 172.29.4.66.domain: 162+ A? host.domain. (29)
21:52:00.464915 IP 10.10.1.120.49321 > 172.29.4.66.domain: 163+ A? www.mimicdns.com. (34)
21:52:00.465129 IP 10.10.1.120.49321 > 172.29.4.66.domain: 164+ A? host.domain. (29)
21:52:00.465250 IP 10.10.1.120.49321 > 172.29.4.66.domain: 165+ A? www.mimicdns.com. (34)
21:52:00.465363 IP 10.10.1.120.49321 > 172.29.4.66.domain: 166+ A? host.domain. (29)
21:52:00.465474 IP 10.10.1.120.49321 > 172.29.4.66.domain: 167+ A? www.mimicdns.com. (34)
21:52:00.465586 IP 10.10.1.120.49321 > 172.29.4.66.domain: 168+ A? host.domain. (29)
21:52:00.465684 IP 10.10.1.120.49321 > 172.29.4.66.domain: 169+ A? www.mimicdns.com. (34)
21:52:00.465774 IP 10.10.1.120.49321 > 172.29.4.66.domain: 170+ A? host.domain. (29)
21:52:00.465904 IP 10.10.1.120.49321 > 172.29.4.66.domain: 171+ A? www.mimicdns.com. (34)
21:52:00.466016 IP 10.10.1.120.49321 > 172.29.4.66.domain: 172+ A? host.domain. (29)
21:52:00.466089 IP 10.10.1.120.49321 > 172.29.4.66.domain: 173+ A? www.mimicdns.com. (34)
21:52:00.466153 IP 10.10.1.120.49321 > 172.29.4.66.domain: 174+ A? host.domain. (29)
21:52:00.466278 IP 10.10.1.120.49321 > 172.29.4.66.domain: 175+ A? www.mimicdns.com. (34)
21:52:00.466388 IP 10.10.1.120.49321 > 172.29.4.66.domain: 176+ A? host.domain. (29)
21:52:00.466503 IP 10.10.1.120.49321 > 172.29.4.66.domain: 177+ A? www.mimicdns.com. (34)
21:52:00.466598 IP 10.10.1.120.49321 > 172.29.4.66.domain: 178+ A? host.domain. (29)
21:52:00.466710 IP 10.10.1.120.49321 > 172.29.4.66.domain: 179+ A? www.mimicdns.com. (34)
21:52:00.466821 IP 10.10.1.120.49321 > 172.29.4.66.domain: 180+ A? host.domain. (29)
21:52:14.839078 IP 10.10.1.120.33145 > 172.29.4.66.domain: 24696+ TXT? _nfsv4idmapdomain. (35)
21:52:14.842123 IP 10.10.1.120.34357 > 172.29.4.66.domain: 24696+ TXT? _nfsv4idmapdomain. (35)
21:52:20.464593 IP 10.10.1.120.49321 > 172.29.4.66.domain: 181+ A? www.mimicdns.com. (34)
21:52:20.464751 IP 10.10.1.120.49321 > 172.29.4.66.domain: 182+ A? host.domain. (29)
21:52:20.464864 IP 10.10.1.120.49321 > 172.29.4.66.domain: 183+ A? www.mimicdns.com. (34)
21:52:20.465036 IP 10.10.1.120.49321 > 172.29.4.66.domain: 184+ A? host.domain. (29)
21:52:20.465231 IP 10.10.1.120.49321 > 172.29.4.66.domain: 185+ A? www.mimicdns.com. (34)
21:52:20.465343 IP 10.10.1.120.49321 > 172.29.4.66.domain: 186+ A? host.domain. (29)
21:52:20.465456 IP 10.10.1.120.49321 > 172.29.4.66.domain: 187+ A? www.mimicdns.com. (34)
21:52:20.465550 IP 10.10.1.120.49321 > 172.29.4.66.domain: 188+ A? host.domain. (29)
21:52:20.465675 IP 10.10.1.120.49321 > 172.29.4.66.domain: 189+ A? www.mimicdns.com. (34)
21:52:20.465778 IP 10.10.1.120.49321 > 172.29.4.66.domain: 190+ A? host.domain. (29)
21:52:20.465890 IP 10.10.1.120.49321 > 172.29.4.66.domain: 191+ A? www.mimicdns.com. (34)
21:52:20.466002 IP 10.10.1.120.49321 > 172.29.4.66.domain: 192+ A? host.domain. (29)
21:52:20.466105 IP 10.10.1.120.49321 > 172.29.4.66.domain: 193+ A? www.mimicdns.com. (34)
21:52:20.466193 IP 10.10.1.120.49321 > 172.29.4.66.domain: 194+ A? host.domain. (29)
21:52:20.466306 IP 10.10.1.120.49321 > 172.29.4.66.domain: 195+ A? www.mimicdns.com. (34)
21:52:20.466396 IP 10.10.1.120.49321 > 172.29.4.66.domain: 196+ A? host.domain. (29)
21:52:20.466487 IP 10.10.1.120.49321 > 172.29.4.66.domain: 197+ A? www.mimicdns.com. (34)
21:52:20.466580 IP 10.10.1.120.49321 > 172.29.4.66.domain: 198+ A? host.domain. (29)
21:52:20.466703 IP 10.10.1.120.49321 > 172.29.4.66.domain: 199+ A? www.mimicdns.com. (34)
21:52:20.466704 IP 10.10.1.120.49321 > 172.29.4.66.domain: 200+ A? host.domain. (29)
21:52:40.463779 IP 10.10.1.120.49321 > 172.29.4.66.domain: 201+ A? www.mimicdns.com. (34)
21:52:40.463942 IP 10.10.1.120.49321 > 172.29.4.66.domain: 202+ A? host.domain. (29)
21:52:40.464056 IP 10.10.1.120.49321 > 172.29.4.66.domain: 203+ A? www.mimicdns.com. (34)
21:52:40.464279 IP 10.10.1.120.49321 > 172.29.4.66.domain: 204+ A? host.domain. (29)
21:52:40.464462 IP 10.10.1.120.49321 > 172.29.4.66.domain: 205+ A? www.mimicdns.com. (34)
21:52:40.464594 IP 10.10.1.120.49321 > 172.29.4.66.domain: 206+ A? host.domain. (29)
21:52:40.464707 IP 10.10.1.120.49321 > 172.29.4.66.domain: 207+ A? www.mimicdns.com. (34)
21:52:40.464765 IP 10.10.1.120.49321 > 172.29.4.66.domain: 208+ A? host.domain. (29)
21:52:40.464891 IP 10.10.1.120.49321 > 172.29.4.66.domain: 209+ A? www.mimicdns.com. (34)
21:52:40.465004 IP 10.10.1.120.49321 > 172.29.4.66.domain: 210+ A? host.domain. (29)
21:52:40.465183 IP 10.10.1.120.49321 > 172.29.4.66.domain: 211+ A? www.mimicdns.com. (34)
21:52:40.465298 IP 10.10.1.120.49321 > 172.29.4.66.domain: 212+ A? host.domain. (29)
21:52:40.465412 IP 10.10.1.120.49321 > 172.29.4.66.domain: 213+ A? www.mimicdns.com. (34)
21:52:40.465525 IP 10.10.1.120.49321 > 172.29.4.66.domain: 214+ A? host.domain. (29)
21:52:40.465645 IP 10.10.1.120.49321 > 172.29.4.66.domain: 215+ A? www.mimicdns.com. (34)
21:52:40.465763 IP 10.10.1.120.49321 > 172.29.4.66.domain: 216+ A? host.domain. (29)
21:52:40.465862 IP 10.10.1.120.49321 > 172.29.4.66.domain: 217+ A? www.mimicdns.com. (34)
21:52:40.465975 IP 10.10.1.120.49321 > 172.29.4.66.domain: 218+ A? host.domain. (29)
21:52:40.466088 IP 10.10.1.120.49321 > 172.29.4.66.domain: 219+ A? www.mimicdns.com. (34)
21:52:40.466249 IP 10.10.1.120.49321 > 172.29.4.66.domain: 220+ A? host.domain. (29)
21:52:44.639958 IP 10.10.1.120.36701 > 172.29.4.66.domain: 24634+ TXT? _nfsv4idmapdomain. (35)
21:52:44.642855 IP 10.10.1.120.53139 > 172.29.4.66.domain: 24634+ TXT? _nfsv4idmapdomain. (35)
21:52:44.846679 IP 10.10.1.120.48405 > 172.29.4.66.domain: 9547+ TXT? _nfsv4idmapdomain. (35)
21:52:44.848510 IP 10.10.1.120.41795 > 172.29.4.66.domain: 9547+ TXT? _nfsv4idmapdomain. (35)
21:53:00.464999 IP 10.10.1.120.49321 > 172.29.4.66.domain: 221+ A? www.mimicdns.com. (34)
21:53:00.465153 IP 10.10.1.120.49321 > 172.29.4.66.domain: 222+ A? host.domain. (29)
21:53:00.465267 IP 10.10.1.120.49321 > 172.29.4.66.domain: 223+ A? www.mimicdns.com. (34)
21:53:00.465393 IP 10.10.1.120.49321 > 172.29.4.66.domain: 224+ A? host.domain. (29)
21:53:00.465599 IP 10.10.1.120.49321 > 172.29.4.66.domain: 225+ A? www.mimicdns.com. (34)
21:53:00.465726 IP 10.10.1.120.49321 > 172.29.4.66.domain: 226+ A? host.domain. (29)
21:53:00.465839 IP 10.10.1.120.49321 > 172.29.4.66.domain: 227+ A? www.mimicdns.com. (34)
21:53:00.465923 IP 10.10.1.120.49321 > 172.29.4.66.domain: 228+ A? host.domain. (29)
21:53:00.466036 IP 10.10.1.120.49321 > 172.29.4.66.domain: 229+ A? www.mimicdns.com. (34)
21:53:00.466103 IP 10.10.1.120.49321 > 172.29.4.66.domain: 230+ A? host.domain. (29)
21:53:00.466213 IP 10.10.1.120.49321 > 172.29.4.66.domain: 231+ A? www.mimicdns.com. (34)
21:53:00.466309 IP 10.10.1.120.49321 > 172.29.4.66.domain: 232+ A? host.domain. (29)
21:53:00.466412 IP 10.10.1.120.49321 > 172.29.4.66.domain: 233+ A? www.mimicdns.com. (34)
21:53:00.466471 IP 10.10.1.120.49321 > 172.29.4.66.domain: 234+ A? host.domain. (29)
21:53:00.466579 IP 10.10.1.120.49321 > 172.29.4.66.domain: 235+ A? www.mimicdns.com. (34)
21:53:00.466658 IP 10.10.1.120.49321 > 172.29.4.66.domain: 236+ A? host.domain. (29)
21:53:00.466728 IP 10.10.1.120.49321 > 172.29.4.66.domain: 237+ A? www.mimicdns.com. (34)
21:53:00.466823 IP 10.10.1.120.49321 > 172.29.4.66.domain: 238+ A? host.domain. (29)
21:53:00.466936 IP 10.10.1.120.49321 > 172.29.4.66.domain: 239+ A? www.mimicdns.com. (34)
21:53:00.467028 IP 10.10.1.120.49321 > 172.29.4.66.domain: 240+ A? host.domain. (29)
21:53:14.854219 IP 10.10.1.120.36134 > 172.29.4.66.domain: 59729+ TXT? _nfsv4idmapdomain. (35)
21:53:14.856447 IP 10.10.1.120.36374 > 172.29.4.66.domain: 59729+ TXT? _nfsv4idmapdomain. (35)
21:53:20.464038 IP 10.10.1.120.49321 > 172.29.4.66.domain: 241+ A? www.mimicdns.com. (34)
21:53:20.464166 IP 10.10.1.120.49321 > 172.29.4.66.domain: 242+ A? host.domain. (29)
21:53:20.464279 IP 10.10.1.120.49321 > 172.29.4.66.domain: 243+ A? www.mimicdns.com. (34)
21:53:20.464529 IP 10.10.1.120.49321 > 172.29.4.66.domain: 244+ A? host.domain. (29)
21:53:20.464641 IP 10.10.1.120.49321 > 172.29.4.66.domain: 245+ A? www.mimicdns.com. (34)
21:53:20.464753 IP 10.10.1.120.49321 > 172.29.4.66.domain: 246+ A? host.domain. (29)
21:53:20.464862 IP 10.10.1.120.49321 > 172.29.4.66.domain: 247+ A? www.mimicdns.com. (34)
21:53:20.464921 IP 10.10.1.120.49321 > 172.29.4.66.domain: 248+ A? host.domain. (29)
21:53:20.465027 IP 10.10.1.120.49321 > 172.29.4.66.domain: 249+ A? www.mimicdns.com. (34)
21:53:20.465141 IP 10.10.1.120.49321 > 172.29.4.66.domain: 250+ A? host.domain. (29)
21:53:20.465254 IP 10.10.1.120.49321 > 172.29.4.66.domain: 251+ A? www.mimicdns.com. (34)
21:53:20.465314 IP 10.10.1.120.49321 > 172.29.4.66.domain: 252+ A? host.domain. (29)
21:53:20.465420 IP 10.10.1.120.49321 > 172.29.4.66.domain: 253+ A? www.mimicdns.com. (34)
21:53:20.465498 IP 10.10.1.120.49321 > 172.29.4.66.domain: 254+ A? host.domain. (29)
21:53:20.465569 IP 10.10.1.120.49321 > 172.29.4.66.domain: 255+ A? www.mimicdns.com. (34)
21:53:20.465680 IP 10.10.1.120.49321 > 172.29.4.66.domain: 256+ A? host.domain. (29)
21:53:20.465781 IP 10.10.1.120.49321 > 172.29.4.66.domain: 257+ A? www.mimicdns.com. (34)
21:53:20.465840 IP 10.10.1.120.49321 > 172.29.4.66.domain: 258+ A? host.domain. (29)
21:53:20.465875 IP 10.10.1.120.49321 > 172.29.4.66.domain: 259+ A? www.mimicdns.com. (34)
21:53:20.465989 IP 10.10.1.120.49321 > 172.29.4.66.domain: 260+ A? host.domain. (29)
21:53:40.465900 IP 10.10.1.120.49321 > 172.29.4.66.domain: 261+ A? www.mimicdns.com. (34)
21:53:40.466033 IP 10.10.1.120.49321 > 172.29.4.66.domain: 262+ A? host.domain. (29)
21:53:40.466147 IP 10.10.1.120.49321 > 172.29.4.66.domain: 263+ A? www.mimicdns.com. (34)
21:53:40.466260 IP 10.10.1.120.49321 > 172.29.4.66.domain: 264+ A? host.domain. (29)
21:53:40.466432 IP 10.10.1.120.49321 > 172.29.4.66.domain: 265+ A? www.mimicdns.com. (34)
21:53:40.466565 IP 10.10.1.120.49321 > 172.29.4.66.domain: 266+ A? host.domain. (29)
21:53:40.466766 IP 10.10.1.120.49321 > 172.29.4.66.domain: 267+ A? www.mimicdns.com. (34)
21:53:40.466810 IP 10.10.1.120.49321 > 172.29.4.66.domain: 268+ A? host.domain. (29)
21:53:40.466875 IP 10.10.1.120.49321 > 172.29.4.66.domain: 269+ A? www.mimicdns.com. (34)
21:53:40.467004 IP 10.10.1.120.49321 > 172.29.4.66.domain: 270+ A? host.domain. (29)
21:53:40.467087 IP 10.10.1.120.49321 > 172.29.4.66.domain: 271+ A? www.mimicdns.com. (34)
21:53:40.467148 IP 10.10.1.120.49321 > 172.29.4.66.domain: 272+ A? host.domain. (29)
21:53:40.467247 IP 10.10.1.120.49321 > 172.29.4.66.domain: 273+ A? www.mimicdns.com. (34)
21:53:40.467321 IP 10.10.1.120.49321 > 172.29.4.66.domain: 274+ A? host.domain. (29)
21:53:40.467347 IP 10.10.1.120.49321 > 172.29.4.66.domain: 275+ A? www.mimicdns.com. (34)
21:53:40.467433 IP 10.10.1.120.49321 > 172.29.4.66.domain: 276+ A? host.domain. (29)
21:53:40.467459 IP 10.10.1.120.49321 > 172.29.4.66.domain: 277+ A? www.mimicdns.com. (34)
21:53:40.467553 IP 10.10.1.120.49321 > 172.29.4.66.domain: 278+ A? host.domain. (29)
21:53:40.467674 IP 10.10.1.120.49321 > 172.29.4.66.domain: 279+ A? www.mimicdns.com. (34)
21:53:40.467732 IP 10.10.1.120.49321 > 172.29.4.66.domain: 280+ A? host.domain. (29)
21:53:44.860183 IP 10.10.1.120.57280 > 172.29.4.66.domain: 20204+ TXT? _nfsv4idmapdomain. (35)
21:53:44.862007 IP 10.10.1.120.56213 > 172.29.4.66.domain: 20204+ TXT? _nfsv4idmapdomain. (35)
21:54:00.464633 IP 10.10.1.120.49321 > 172.29.4.66.domain: 281+ A? www.mimicdns.com. (34)
21:54:00.464771 IP 10.10.1.120.49321 > 172.29.4.66.domain: 282+ A? host.domain. (29)
21:54:00.464900 IP 10.10.1.120.49321 > 172.29.4.66.domain: 283+ A? www.mimicdns.com. (34)
21:54:00.465024 IP 10.10.1.120.49321 > 172.29.4.66.domain: 284+ A? host.domain. (29)
21:54:00.465152 IP 10.10.1.120.49321 > 172.29.4.66.domain: 285+ A? www.mimicdns.com. (34)
21:54:00.465325 IP 10.10.1.120.49321 > 172.29.4.66.domain: 286+ A? host.domain. (29)
21:54:00.465439 IP 10.10.1.120.49321 > 172.29.4.66.domain: 287+ A? www.mimicdns.com. (34)
21:54:00.465499 IP 10.10.1.120.49321 > 172.29.4.66.domain: 288+ A? host.domain. (29)
21:54:00.465618 IP 10.10.1.120.49321 > 172.29.4.66.domain: 289+ A? www.mimicdns.com. (34)
21:54:00.465619 IP 10.10.1.120.49321 > 172.29.4.66.domain: 290+ A? host.domain. (29)
21:54:00.465746 IP 10.10.1.120.49321 > 172.29.4.66.domain: 291+ A? www.mimicdns.com. (34)
21:54:00.465816 IP 10.10.1.120.49321 > 172.29.4.66.domain: 292+ A? host.domain. (29)
21:54:00.465931 IP 10.10.1.120.49321 > 172.29.4.66.domain: 293+ A? www.mimicdns.com. (34)
21:54:00.466021 IP 10.10.1.120.49321 > 172.29.4.66.domain: 294+ A? host.domain. (29)
21:54:00.466144 IP 10.10.1.120.49321 > 172.29.4.66.domain: 295+ A? www.mimicdns.com. (34)
21:54:00.466241 IP 10.10.1.120.49321 > 172.29.4.66.domain: 296+ A? host.domain. (29)
21:54:00.466345 IP 10.10.1.120.49321 > 172.29.4.66.domain: 297+ A? www.mimicdns.com. (34)
21:54:00.466420 IP 10.10.1.120.49321 > 172.29.4.66.domain: 298+ A? host.domain. (29)
21:54:00.466536 IP 10.10.1.120.49321 > 172.29.4.66.domain: 299+ A? www.mimicdns.com. (34)
21:54:00.466596 IP 10.10.1.120.49321 > 172.29.4.66.domain: 300+ A? host.domain. (29)
21:54:14.868821 IP 10.10.1.120.61738 > 172.29.4.66.domain: 6499+ TXT? _nfsv4idmapdomain. (35)
21:54:14.871482 IP 10.10.1.120.41860 > 172.29.4.66.domain: 6499+ TXT? _nfsv4idmapdomain. (35)
21:54:20.465874 IP 10.10.1.120.49321 > 172.29.4.66.domain: 301+ A? www.mimicdns.com. (34)
21:54:20.466005 IP 10.10.1.120.49321 > 172.29.4.66.domain: 302+ A? host.domain. (29)
21:54:20.466111 IP 10.10.1.120.49321 > 172.29.4.66.domain: 303+ A? www.mimicdns.com. (34)
21:54:20.466296 IP 10.10.1.120.49321 > 172.29.4.66.domain: 304+ A? host.domain. (29)
21:54:20.466470 IP 10.10.1.120.49321 > 172.29.4.66.domain: 305+ A? www.mimicdns.com. (34)
21:54:20.466587 IP 10.10.1.120.49321 > 172.29.4.66.domain: 306+ A? host.domain. (29)
21:54:20.466699 IP 10.10.1.120.49321 > 172.29.4.66.domain: 307+ A? www.mimicdns.com. (34)
21:54:20.466776 IP 10.10.1.120.49321 > 172.29.4.66.domain: 308+ A? host.domain. (29)
21:54:20.466852 IP 10.10.1.120.49321 > 172.29.4.66.domain: 309+ A? www.mimicdns.com. (34)
21:54:20.466918 IP 10.10.1.120.49321 > 172.29.4.66.domain: 310+ A? host.domain. (29)
21:54:20.467022 IP 10.10.1.120.49321 > 172.29.4.66.domain: 311+ A? www.mimicdns.com. (34)
21:54:20.467105 IP 10.10.1.120.49321 > 172.29.4.66.domain: 312+ A? host.domain. (29)
21:54:20.467293 IP 10.10.1.120.49321 > 172.29.4.66.domain: 313+ A? www.mimicdns.com. (34)
21:54:20.467390 IP 10.10.1.120.49321 > 172.29.4.66.domain: 314+ A? host.domain. (29)
21:54:20.467391 IP 10.10.1.120.49321 > 172.29.4.66.domain: 315+ A? www.mimicdns.com. (34)
21:54:20.467482 IP 10.10.1.120.49321 > 172.29.4.66.domain: 316+ A? host.domain. (29)
21:54:20.467571 IP 10.10.1.120.49321 > 172.29.4.66.domain: 317+ A? www.mimicdns.com. (34)
21:54:20.467604 IP 10.10.1.120.49321 > 172.29.4.66.domain: 318+ A? host.domain. (29)
21:54:20.467668 IP 10.10.1.120.49321 > 172.29.4.66.domain: 319+ A? www.mimicdns.com. (34)
21:54:20.467812 IP 10.10.1.120.49321 > 172.29.4.66.domain: 320+ A? host.domain. (29)
21:54:40.464585 IP 10.10.1.120.49321 > 172.29.4.66.domain: 321+ A? www.mimicdns.com. (34)
21:54:40.464749 IP 10.10.1.120.49321 > 172.29.4.66.domain: 322+ A? host.domain. (29)
21:54:40.464863 IP 10.10.1.120.49321 > 172.29.4.66.domain: 323+ A? www.mimicdns.com. (34)
21:54:40.464982 IP 10.10.1.120.49321 > 172.29.4.66.domain: 324+ A? host.domain. (29)
21:54:40.465105 IP 10.10.1.120.49321 > 172.29.4.66.domain: 325+ A? www.mimicdns.com. (34)
21:54:40.465219 IP 10.10.1.120.49321 > 172.29.4.66.domain: 326+ A? host.domain. (29)
21:54:40.465330 IP 10.10.1.120.49321 > 172.29.4.66.domain: 327+ A? www.mimicdns.com. (34)
21:54:40.465413 IP 10.10.1.120.49321 > 172.29.4.66.domain: 328+ A? host.domain. (29)
21:54:40.465525 IP 10.10.1.120.49321 > 172.29.4.66.domain: 329+ A? www.mimicdns.com. (34)
21:54:40.465623 IP 10.10.1.120.49321 > 172.29.4.66.domain: 330+ A? host.domain. (29)
21:54:40.465684 IP 10.10.1.120.49321 > 172.29.4.66.domain: 331+ A? www.mimicdns.com. (34)
21:54:40.465725 IP 10.10.1.120.49321 > 172.29.4.66.domain: 332+ A? host.domain. (29)
21:54:40.465845 IP 10.10.1.120.49321 > 172.29.4.66.domain: 333+ A? www.mimicdns.com. (34)
21:54:40.465903 IP 10.10.1.120.49321 > 172.29.4.66.domain: 334+ A? host.domain. (29)
21:54:40.466004 IP 10.10.1.120.49321 > 172.29.4.66.domain: 335+ A? www.mimicdns.com. (34)
21:54:40.466115 IP 10.10.1.120.49321 > 172.29.4.66.domain: 336+ A? host.domain. (29)
21:54:40.466244 IP 10.10.1.120.49321 > 172.29.4.66.domain: 337+ A? www.mimicdns.com. (34)
21:54:40.466245 IP 10.10.1.120.49321 > 172.29.4.66.domain: 338+ A? host.domain. (29)
21:54:40.466358 IP 10.10.1.120.49321 > 172.29.4.66.domain: 339+ A? www.mimicdns.com. (34)
21:54:40.466359 IP 10.10.1.120.49321 > 172.29.4.66.domain: 340+ A? host.domain. (29)
21:54:44.878290 IP 10.10.1.120.39883 > 172.29.4.66.domain: 42521+ TXT? _nfsv4idmapdomain. (35)
21:54:44.881083 IP 10.10.1.120.34638 > 172.29.4.66.domain: 42521+ TXT? _nfsv4idmapdomain. (35)
21:55:00.464456 IP 10.10.1.120.49321 > 172.29.4.66.domain: 341+ A? www.mimicdns.com. (34)
21:55:00.464558 IP 10.10.1.120.49321 > 172.29.4.66.domain: 342+ A? host.domain. (29)
21:55:00.464672 IP 10.10.1.120.49321 > 172.29.4.66.domain: 343+ A? www.mimicdns.com. (34)
21:55:00.464851 IP 10.10.1.120.49321 > 172.29.4.66.domain: 344+ A? host.domain. (29)
21:55:00.465023 IP 10.10.1.120.49321 > 172.29.4.66.domain: 345+ A? www.mimicdns.com. (34)
21:55:00.465134 IP 10.10.1.120.49321 > 172.29.4.66.domain: 346+ A? host.domain. (29)
21:55:00.465233 IP 10.10.1.120.49321 > 172.29.4.66.domain: 347+ A? www.mimicdns.com. (34)
21:55:00.465334 IP 10.10.1.120.49321 > 172.29.4.66.domain: 348+ A? host.domain. (29)
21:55:00.465431 IP 10.10.1.120.49321 > 172.29.4.66.domain: 349+ A? www.mimicdns.com. (34)
21:55:00.465542 IP 10.10.1.120.49321 > 172.29.4.66.domain: 350+ A? host.domain. (29)
21:55:00.465629 IP 10.10.1.120.49321 > 172.29.4.66.domain: 351+ A? www.mimicdns.com. (34)
21:55:00.465741 IP 10.10.1.120.49321 > 172.29.4.66.domain: 352+ A? host.domain. (29)
21:55:00.465802 IP 10.10.1.120.49321 > 172.29.4.66.domain: 353+ A? www.mimicdns.com. (34)
21:55:00.465888 IP 10.10.1.120.49321 > 172.29.4.66.domain: 354+ A? host.domain. (29)
21:55:00.466001 IP 10.10.1.120.49321 > 172.29.4.66.domain: 355+ A? www.mimicdns.com. (34)
21:55:00.466083 IP 10.10.1.120.49321 > 172.29.4.66.domain: 356+ A? host.domain. (29)
21:55:00.466188 IP 10.10.1.120.49321 > 172.29.4.66.domain: 357+ A? www.mimicdns.com. (34)
21:55:00.466300 IP 10.10.1.120.49321 > 172.29.4.66.domain: 358+ A? host.domain. (29)
21:55:00.466399 IP 10.10.1.120.49321 > 172.29.4.66.domain: 359+ A? www.mimicdns.com. (34)
21:55:00.466477 IP 10.10.1.120.49321 > 172.29.4.66.domain: 360+ A? host.domain. (29)
21:55:14.895413 IP 10.10.1.120.49405 > 172.29.4.66.domain: 25994+ TXT? _nfsv4idmapdomain. (35)
21:55:14.898344 IP 10.10.1.120.58493 > 172.29.4.66.domain: 25994+ TXT? _nfsv4idmapdomain. (35)
21:55:20.469971 IP 10.10.1.120.49321 > 172.29.4.66.domain: 361+ A? www.mimicdns.com. (34)
21:55:20.470190 IP 10.10.1.120.49321 > 172.29.4.66.domain: 362+ A? host.domain. (29)
21:55:20.470314 IP 10.10.1.120.49321 > 172.29.4.66.domain: 363+ A? www.mimicdns.com. (34)
21:55:20.470502 IP 10.10.1.120.49321 > 172.29.4.66.domain: 364+ A? host.domain. (29)
21:55:20.470627 IP 10.10.1.120.49321 > 172.29.4.66.domain: 365+ A? www.mimicdns.com. (34)
21:55:20.470790 IP 10.10.1.120.49321 > 172.29.4.66.domain: 366+ A? host.domain. (29)
21:55:20.470828 IP 10.10.1.120.49321 > 172.29.4.66.domain: 367+ A? www.mimicdns.com. (34)
21:55:20.471045 IP 10.10.1.120.49321 > 172.29.4.66.domain: 368+ A? host.domain. (29)
21:55:20.471138 IP 10.10.1.120.49321 > 172.29.4.66.domain: 369+ A? www.mimicdns.com. (34)
21:55:20.471198 IP 10.10.1.120.49321 > 172.29.4.66.domain: 370+ A? host.domain. (29)
21:55:20.471313 IP 10.10.1.120.49321 > 172.29.4.66.domain: 371+ A? www.mimicdns.com. (34)
21:55:20.471427 IP 10.10.1.120.49321 > 172.29.4.66.domain: 372+ A? host.domain. (29)
21:55:20.471529 IP 10.10.1.120.49321 > 172.29.4.66.domain: 373+ A? www.mimicdns.com. (34)
21:55:20.471595 IP 10.10.1.120.49321 > 172.29.4.66.domain: 374+ A? host.domain. (29)
21:55:20.471708 IP 10.10.1.120.49321 > 172.29.4.66.domain: 375+ A? www.mimicdns.com. (34)
21:55:20.471822 IP 10.10.1.120.49321 > 172.29.4.66.domain: 376+ A? host.domain. (29)
21:55:20.472046 IP 10.10.1.120.49321 > 172.29.4.66.domain: 377+ A? www.mimicdns.com. (34)
21:55:20.472079 IP 10.10.1.120.49321 > 172.29.4.66.domain: 378+ A? host.domain. (29)
21:55:20.472162 IP 10.10.1.120.49321 > 172.29.4.66.domain: 379+ A? www.mimicdns.com. (34)
21:55:20.472436 IP 10.10.1.120.49321 > 172.29.4.66.domain: 380+ A? host.domain. (29)
21:55:40.466052 IP 10.10.1.120.49321 > 172.29.4.66.domain: 381+ A? www.mimicdns.com. (34)
21:55:40.466188 IP 10.10.1.120.49321 > 172.29.4.66.domain: 382+ A? host.domain. (29)
21:55:40.466301 IP 10.10.1.120.49321 > 172.29.4.66.domain: 383+ A? www.mimicdns.com. (34)
21:55:40.466421 IP 10.10.1.120.49321 > 172.29.4.66.domain: 384+ A? host.domain. (29)
21:55:40.466599 IP 10.10.1.120.49321 > 172.29.4.66.domain: 385+ A? www.mimicdns.com. (34)
21:55:40.466686 IP 10.10.1.120.49321 > 172.29.4.66.domain: 386+ A? host.domain. (29)
21:55:40.466748 IP 10.10.1.120.49321 > 172.29.4.66.domain: 387+ A? www.mimicdns.com. (34)
21:55:40.466788 IP 10.10.1.120.49321 > 172.29.4.66.domain: 388+ A? host.domain. (29)
21:55:40.466927 IP 10.10.1.120.49321 > 172.29.4.66.domain: 389+ A? www.mimicdns.com. (34)
21:55:40.466998 IP 10.10.1.120.49321 > 172.29.4.66.domain: 390+ A? host.domain. (29)
21:55:40.467110 IP 10.10.1.120.49321 > 172.29.4.66.domain: 391+ A? www.mimicdns.com. (34)
21:55:40.467213 IP 10.10.1.120.49321 > 172.29.4.66.domain: 392+ A? host.domain. (29)
21:55:40.467336 IP 10.10.1.120.49321 > 172.29.4.66.domain: 393+ A? www.mimicdns.com. (34)
21:55:40.467338 IP 10.10.1.120.49321 > 172.29.4.66.domain: 394+ A? host.domain. (29)
21:55:40.467453 IP 10.10.1.120.49321 > 172.29.4.66.domain: 395+ A? www.mimicdns.com. (34)
21:55:40.467564 IP 10.10.1.120.49321 > 172.29.4.66.domain: 396+ A? host.domain. (29)
21:55:40.467677 IP 10.10.1.120.49321 > 172.29.4.66.domain: 397+ A? www.mimicdns.com. (34)
21:55:40.467783 IP 10.10.1.120.49321 > 172.29.4.66.domain: 398+ A? host.domain. (29)
21:55:40.467844 IP 10.10.1.120.49321 > 172.29.4.66.domain: 399+ A? www.mimicdns.com. (34)
21:55:40.467881 IP 10.10.1.120.49321 > 172.29.4.66.domain: 400+ A? host.domain. (29)
21:55:44.904489 IP 10.10.1.120.59460 > 172.29.4.66.domain: 63717+ TXT? _nfsv4idmapdomain. (35)
21:55:44.906883 IP 10.10.1.120.39453 > 172.29.4.66.domain: 63717+ TXT? _nfsv4idmapdomain. (35)
21:56:00.464960 IP 10.10.1.120.49321 > 172.29.4.66.domain: 401+ A? www.mimicdns.com. (34)
21:56:00.465082 IP 10.10.1.120.49321 > 172.29.4.66.domain: 402+ A? host.domain. (29)
21:56:00.465272 IP 10.10.1.120.49321 > 172.29.4.66.domain: 403+ A? www.mimicdns.com. (34)
21:56:00.465390 IP 10.10.1.120.49321 > 172.29.4.66.domain: 404+ A? host.domain. (29)
21:56:00.465612 IP 10.10.1.120.49321 > 172.29.4.66.domain: 405+ A? www.mimicdns.com. (34)
21:56:00.465786 IP 10.10.1.120.49321 > 172.29.4.66.domain: 406+ A? host.domain. (29)
21:56:00.465899 IP 10.10.1.120.49321 > 172.29.4.66.domain: 407+ A? www.mimicdns.com. (34)
21:56:00.466001 IP 10.10.1.120.49321 > 172.29.4.66.domain: 408+ A? host.domain. (29)
21:56:00.466114 IP 10.10.1.120.49321 > 172.29.4.66.domain: 409+ A? www.mimicdns.com. (34)
21:56:00.466187 IP 10.10.1.120.49321 > 172.29.4.66.domain: 410+ A? host.domain. (29)
21:56:00.466300 IP 10.10.1.120.49321 > 172.29.4.66.domain: 411+ A? www.mimicdns.com. (34)
21:56:00.466370 IP 10.10.1.120.49321 > 172.29.4.66.domain: 412+ A? host.domain. (29)
21:56:00.466467 IP 10.10.1.120.49321 > 172.29.4.66.domain: 413+ A? www.mimicdns.com. (34)
21:56:00.466579 IP 10.10.1.120.49321 > 172.29.4.66.domain: 414+ A? host.domain. (29)
21:56:00.466787 IP 10.10.1.120.49321 > 172.29.4.66.domain: 415+ A? www.mimicdns.com. (34)
21:56:00.466877 IP 10.10.1.120.49321 > 172.29.4.66.domain: 416+ A? host.domain. (29)
21:56:00.466958 IP 10.10.1.120.49321 > 172.29.4.66.domain: 417+ A? www.mimicdns.com. (34)
21:56:00.467071 IP 10.10.1.120.49321 > 172.29.4.66.domain: 418+ A? host.domain. (29)
21:56:00.467163 IP 10.10.1.120.49321 > 172.29.4.66.domain: 419+ A? www.mimicdns.com. (34)
21:56:00.467275 IP 10.10.1.120.49321 > 172.29.4.66.domain: 420+ A? host.domain. (29)
21:56:14.918245 IP 10.10.1.120.39023 > 172.29.4.66.domain: 20046+ TXT? _nfsv4idmapdomain. (35)
21:56:14.921297 IP 10.10.1.120.37914 > 172.29.4.66.domain: 20046+ TXT? _nfsv4idmapdomain. (35)
21:56:20.470062 IP 10.10.1.120.49321 > 172.29.4.66.domain: 421+ A? www.mimicdns.com. (34)
21:56:20.470199 IP 10.10.1.120.49321 > 172.29.4.66.domain: 422+ A? host.domain. (29)
21:56:20.470313 IP 10.10.1.120.49321 > 172.29.4.66.domain: 423+ A? www.mimicdns.com. (34)
21:56:20.470424 IP 10.10.1.120.49321 > 172.29.4.66.domain: 424+ A? host.domain. (29)
21:56:20.470553 IP 10.10.1.120.49321 > 172.29.4.66.domain: 425+ A? www.mimicdns.com. (34)
21:56:20.470665 IP 10.10.1.120.49321 > 172.29.4.66.domain: 426+ A? host.domain. (29)
21:56:20.470777 IP 10.10.1.120.49321 > 172.29.4.66.domain: 427+ A? www.mimicdns.com. (34)
21:56:20.470875 IP 10.10.1.120.49321 > 172.29.4.66.domain: 428+ A? host.domain. (29)
21:56:20.470994 IP 10.10.1.120.49321 > 172.29.4.66.domain: 429+ A? www.mimicdns.com. (34)
21:56:20.470995 IP 10.10.1.120.49321 > 172.29.4.66.domain: 430+ A? host.domain. (29)
21:56:20.471094 IP 10.10.1.120.49321 > 172.29.4.66.domain: 431+ A? www.mimicdns.com. (34)
21:56:20.471175 IP 10.10.1.120.49321 > 172.29.4.66.domain: 432+ A? host.domain. (29)
21:56:20.471274 IP 10.10.1.120.49321 > 172.29.4.66.domain: 433+ A? www.mimicdns.com. (34)
21:56:20.471368 IP 10.10.1.120.49321 > 172.29.4.66.domain: 434+ A? host.domain. (29)
21:56:20.471540 IP 10.10.1.120.49321 > 172.29.4.66.domain: 435+ A? www.mimicdns.com. (34)
21:56:20.471582 IP 10.10.1.120.49321 > 172.29.4.66.domain: 436+ A? host.domain. (29)
21:56:20.471637 IP 10.10.1.120.49321 > 172.29.4.66.domain: 437+ A? www.mimicdns.com. (34)
21:56:20.471715 IP 10.10.1.120.49321 > 172.29.4.66.domain: 438+ A? host.domain. (29)
21:56:20.471845 IP 10.10.1.120.49321 > 172.29.4.66.domain: 439+ A? www.mimicdns.com. (34)
21:56:20.471933 IP 10.10.1.120.49321 > 172.29.4.66.domain: 440+ A? host.domain. (29)
21:56:40.465211 IP 10.10.1.120.49321 > 172.29.4.66.domain: 441+ A? www.mimicdns.com. (34)
21:56:40.465347 IP 10.10.1.120.49321 > 172.29.4.66.domain: 442+ A? host.domain. (29)
21:56:40.465464 IP 10.10.1.120.49321 > 172.29.4.66.domain: 443+ A? www.mimicdns.com. (34)
21:56:40.465569 IP 10.10.1.120.49321 > 172.29.4.66.domain: 444+ A? host.domain. (29)
21:56:40.465684 IP 10.10.1.120.49321 > 172.29.4.66.domain: 445+ A? www.mimicdns.com. (34)
21:56:40.465815 IP 10.10.1.120.49321 > 172.29.4.66.domain: 446+ A? host.domain. (29)
21:56:40.465931 IP 10.10.1.120.49321 > 172.29.4.66.domain: 447+ A? www.mimicdns.com. (34)
21:56:40.466042 IP 10.10.1.120.49321 > 172.29.4.66.domain: 448+ A? host.domain. (29)
21:56:40.466143 IP 10.10.1.120.49321 > 172.29.4.66.domain: 449+ A? www.mimicdns.com. (34)
21:56:40.466249 IP 10.10.1.120.49321 > 172.29.4.66.domain: 450+ A? host.domain. (29)
21:56:40.466306 IP 10.10.1.120.49321 > 172.29.4.66.domain: 451+ A? www.mimicdns.com. (34)
21:56:40.466428 IP 10.10.1.120.49321 > 172.29.4.66.domain: 452+ A? host.domain. (29)
21:56:40.466543 IP 10.10.1.120.49321 > 172.29.4.66.domain: 453+ A? www.mimicdns.com. (34)
21:56:40.466638 IP 10.10.1.120.49321 > 172.29.4.66.domain: 454+ A? host.domain. (29)
21:56:40.466752 IP 10.10.1.120.49321 > 172.29.4.66.domain: 455+ A? www.mimicdns.com. (34)
21:56:40.466864 IP 10.10.1.120.49321 > 172.29.4.66.domain: 456+ A? host.domain. (29)
21:56:40.466947 IP 10.10.1.120.49321 > 172.29.4.66.domain: 457+ A? www.mimicdns.com. (34)
21:56:40.467060 IP 10.10.1.120.49321 > 172.29.4.66.domain: 458+ A? host.domain. (29)
21:56:40.467279 IP 10.10.1.120.49321 > 172.29.4.66.domain: 459+ A? www.mimicdns.com. (34)
21:56:40.467314 IP 10.10.1.120.49321 > 172.29.4.66.domain: 460+ A? host.domain. (29)
21:56:44.935737 IP 10.10.1.120.47970 > 172.29.4.66.domain: 41231+ TXT? _nfsv4idmapdomain. (35)
21:56:44.937960 IP 10.10.1.120.62464 > 172.29.4.66.domain: 41231+ TXT? _nfsv4idmapdomain. (35)
21:57:00.463292 IP 10.10.1.120.49321 > 172.29.4.66.domain: 461+ A? www.mimicdns.com. (34)
21:57:00.463450 IP 10.10.1.120.49321 > 172.29.4.66.domain: 462+ A? host.domain. (29)
21:57:00.463640 IP 10.10.1.120.49321 > 172.29.4.66.domain: 463+ A? www.mimicdns.com. (34)
21:57:00.463861 IP 10.10.1.120.49321 > 172.29.4.66.domain: 464+ A? host.domain. (29)
21:57:00.464076 IP 10.10.1.120.49321 > 172.29.4.66.domain: 465+ A? www.mimicdns.com. (34)
21:57:00.464163 IP 10.10.1.120.49321 > 172.29.4.66.domain: 466+ A? host.domain. (29)
21:57:00.464182 IP 10.10.1.120.49321 > 172.29.4.66.domain: 467+ A? www.mimicdns.com. (34)
21:57:00.464282 IP 10.10.1.120.49321 > 172.29.4.66.domain: 468+ A? host.domain. (29)
21:57:00.464394 IP 10.10.1.120.49321 > 172.29.4.66.domain: 469+ A? www.mimicdns.com. (34)
21:57:00.464503 IP 10.10.1.120.49321 > 172.29.4.66.domain: 470+ A? host.domain. (29)
21:57:00.464620 IP 10.10.1.120.49321 > 172.29.4.66.domain: 471+ A? www.mimicdns.com. (34)
21:57:00.464732 IP 10.10.1.120.49321 > 172.29.4.66.domain: 472+ A? host.domain. (29)
21:57:00.464838 IP 10.10.1.120.49321 > 172.29.4.66.domain: 473+ A? www.mimicdns.com. (34)
21:57:00.464951 IP 10.10.1.120.49321 > 172.29.4.66.domain: 474+ A? host.domain. (29)
21:57:00.465047 IP 10.10.1.120.49321 > 172.29.4.66.domain: 475+ A? www.mimicdns.com. (34)
21:57:00.465159 IP 10.10.1.120.49321 > 172.29.4.66.domain: 476+ A? host.domain. (29)
21:57:00.465273 IP 10.10.1.120.49321 > 172.29.4.66.domain: 477+ A? www.mimicdns.com. (34)
21:57:00.465384 IP 10.10.1.120.49321 > 172.29.4.66.domain: 478+ A? host.domain. (29)
21:57:00.465455 IP 10.10.1.120.49321 > 172.29.4.66.domain: 479+ A? www.mimicdns.com. (34)
21:57:00.465571 IP 10.10.1.120.49321 > 172.29.4.66.domain: 480+ A? host.domain. (29)
21:57:14.944713 IP 10.10.1.120.64207 > 172.29.4.66.domain: 40701+ TXT? _nfsv4idmapdomain. (35)
21:57:14.946879 IP 10.10.1.120.37042 > 172.29.4.66.domain: 40701+ TXT? _nfsv4idmapdomain. (35)
21:57:20.460740 IP 10.10.1.120.49321 > 172.29.4.66.domain: 481+ A? www.mimicdns.com. (34)
21:57:20.460901 IP 10.10.1.120.49321 > 172.29.4.66.domain: 482+ A? host.domain. (29)
21:57:20.460990 IP 10.10.1.120.49321 > 172.29.4.66.domain: 483+ A? www.mimicdns.com. (34)
21:57:20.461255 IP 10.10.1.120.49321 > 172.29.4.66.domain: 484+ A? host.domain. (29)
21:57:20.461428 IP 10.10.1.120.49321 > 172.29.4.66.domain: 485+ A? www.mimicdns.com. (34)
21:57:20.461539 IP 10.10.1.120.49321 > 172.29.4.66.domain: 486+ A? host.domain. (29)
21:57:20.461626 IP 10.10.1.120.49321 > 172.29.4.66.domain: 487+ A? www.mimicdns.com. (34)
21:57:20.461627 IP 10.10.1.120.49321 > 172.29.4.66.domain: 488+ A? host.domain. (29)
21:57:20.461741 IP 10.10.1.120.49321 > 172.29.4.66.domain: 489+ A? www.mimicdns.com. (34)
21:57:20.461743 IP 10.10.1.120.49321 > 172.29.4.66.domain: 490+ A? host.domain. (29)
21:57:20.461858 IP 10.10.1.120.49321 > 172.29.4.66.domain: 491+ A? www.mimicdns.com. (34)
21:57:20.461944 IP 10.10.1.120.49321 > 172.29.4.66.domain: 492+ A? host.domain. (29)
21:57:20.462039 IP 10.10.1.120.49321 > 172.29.4.66.domain: 493+ A? www.mimicdns.com. (34)
21:57:20.462116 IP 10.10.1.120.49321 > 172.29.4.66.domain: 494+ A? host.domain. (29)
21:57:20.462222 IP 10.10.1.120.49321 > 172.29.4.66.domain: 495+ A? www.mimicdns.com. (34)
21:57:20.462333 IP 10.10.1.120.49321 > 172.29.4.66.domain: 496+ A? host.domain. (29)
21:57:20.462460 IP 10.10.1.120.49321 > 172.29.4.66.domain: 497+ A? www.mimicdns.com. (34)
21:57:20.462462 IP 10.10.1.120.49321 > 172.29.4.66.domain: 498+ A? host.domain. (29)
21:57:20.462561 IP 10.10.1.120.49321 > 172.29.4.66.domain: 499+ A? www.mimicdns.com. (34)
21:57:20.462685 IP 10.10.1.120.49321 > 172.29.4.66.domain: 500+ A? host.domain. (29)
21:57:40.462976 IP 10.10.1.120.49321 > 172.29.4.66.domain: 501+ A? www.mimicdns.com. (34)
21:57:40.463121 IP 10.10.1.120.49321 > 172.29.4.66.domain: 502+ A? host.domain. (29)
21:57:40.463234 IP 10.10.1.120.49321 > 172.29.4.66.domain: 503+ A? www.mimicdns.com. (34)
21:57:40.463406 IP 10.10.1.120.49321 > 172.29.4.66.domain: 504+ A? host.domain. (29)
21:57:40.463734 IP 10.10.1.120.49321 > 172.29.4.66.domain: 505+ A? www.mimicdns.com. (34)
21:57:40.463735 IP 10.10.1.120.49321 > 172.29.4.66.domain: 506+ A? host.domain. (29)
21:57:40.463847 IP 10.10.1.120.49321 > 172.29.4.66.domain: 507+ A? www.mimicdns.com. (34)
21:57:40.463954 IP 10.10.1.120.49321 > 172.29.4.66.domain: 508+ A? host.domain. (29)
21:57:40.464066 IP 10.10.1.120.49321 > 172.29.4.66.domain: 509+ A? www.mimicdns.com. (34)
21:57:40.464149 IP 10.10.1.120.49321 > 172.29.4.66.domain: 510+ A? host.domain. (29)
21:57:40.464261 IP 10.10.1.120.49321 > 172.29.4.66.domain: 511+ A? www.mimicdns.com. (34)
21:57:40.464362 IP 10.10.1.120.49321 > 172.29.4.66.domain: 512+ A? host.domain. (29)
21:57:40.464475 IP 10.10.1.120.49321 > 172.29.4.66.domain: 513+ A? www.mimicdns.com. (34)
21:57:40.464594 IP 10.10.1.120.49321 > 172.29.4.66.domain: 514+ A? host.domain. (29)
21:57:40.464706 IP 10.10.1.120.49321 > 172.29.4.66.domain: 515+ A? www.mimicdns.com. (34)
21:57:40.464777 IP 10.10.1.120.49321 > 172.29.4.66.domain: 516+ A? host.domain. (29)
21:57:40.464891 IP 10.10.1.120.49321 > 172.29.4.66.domain: 517+ A? www.mimicdns.com. (34)
21:57:40.464977 IP 10.10.1.120.49321 > 172.29.4.66.domain: 518+ A? host.domain. (29)
21:57:40.465107 IP 10.10.1.120.49321 > 172.29.4.66.domain: 519+ A? www.mimicdns.com. (34)
21:57:40.465237 IP 10.10.1.120.49321 > 172.29.4.66.domain: 520+ A? host.domain. (29)
21:57:44.646723 IP 10.10.1.120.34799 > 172.29.4.66.domain: 47071+ TXT? _nfsv4idmapdomain. (35)
21:57:44.648938 IP 10.10.1.120.37385 > 172.29.4.66.domain: 47071+ TXT? _nfsv4idmapdomain. (35)
21:57:44.951074 IP 10.10.1.120.54660 > 172.29.4.66.domain: 28245+ TXT? _nfsv4idmapdomain. (35)
21:57:44.953211 IP 10.10.1.120.55783 > 172.29.4.66.domain: 28245+ TXT? _nfsv4idmapdomain. (35)
21:58:00.462281 IP 10.10.1.120.49321 > 172.29.4.66.domain: 521+ A? www.mimicdns.com. (34)
21:58:00.462443 IP 10.10.1.120.49321 > 172.29.4.66.domain: 522+ A? host.domain. (29)
21:58:00.462599 IP 10.10.1.120.49321 > 172.29.4.66.domain: 523+ A? www.mimicdns.com. (34)
21:58:00.462705 IP 10.10.1.120.49321 > 172.29.4.66.domain: 524+ A? host.domain. (29)
21:58:00.462824 IP 10.10.1.120.49321 > 172.29.4.66.domain: 525+ A? www.mimicdns.com. (34)
21:58:00.462992 IP 10.10.1.120.49321 > 172.29.4.66.domain: 526+ A? host.domain. (29)
21:58:00.463035 IP 10.10.1.120.49321 > 172.29.4.66.domain: 527+ A? www.mimicdns.com. (34)
21:58:00.463170 IP 10.10.1.120.49321 > 172.29.4.66.domain: 528+ A? host.domain. (29)
21:58:00.463279 IP 10.10.1.120.49321 > 172.29.4.66.domain: 529+ A? www.mimicdns.com. (34)
21:58:00.463359 IP 10.10.1.120.49321 > 172.29.4.66.domain: 530+ A? host.domain. (29)
21:58:00.463470 IP 10.10.1.120.49321 > 172.29.4.66.domain: 531+ A? www.mimicdns.com. (34)
21:58:00.463555 IP 10.10.1.120.49321 > 172.29.4.66.domain: 532+ A? host.domain. (29)
21:58:00.463670 IP 10.10.1.120.49321 > 172.29.4.66.domain: 533+ A? www.mimicdns.com. (34)
21:58:00.463766 IP 10.10.1.120.49321 > 172.29.4.66.domain: 534+ A? host.domain. (29)
21:58:00.463877 IP 10.10.1.120.49321 > 172.29.4.66.domain: 535+ A? www.mimicdns.com. (34)
21:58:00.463970 IP 10.10.1.120.49321 > 172.29.4.66.domain: 536+ A? host.domain. (29)
21:58:00.464064 IP 10.10.1.120.49321 > 172.29.4.66.domain: 537+ A? www.mimicdns.com. (34)
21:58:00.464137 IP 10.10.1.120.49321 > 172.29.4.66.domain: 538+ A? host.domain. (29)
21:58:00.464249 IP 10.10.1.120.49321 > 172.29.4.66.domain: 539+ A? www.mimicdns.com. (34)
21:58:00.464369 IP 10.10.1.120.49321 > 172.29.4.66.domain: 540+ A? host.domain. (29)
21:58:14.958689 IP 10.10.1.120.40346 > 172.29.4.66.domain: 42476+ TXT? _nfsv4idmapdomain. (35)
21:58:14.961360 IP 10.10.1.120.43002 > 172.29.4.66.domain: 42476+ TXT? _nfsv4idmapdomain. (35)
21:58:20.463647 IP 10.10.1.120.49321 > 172.29.4.66.domain: 541+ A? www.mimicdns.com. (34)
21:58:20.463890 IP 10.10.1.120.49321 > 172.29.4.66.domain: 542+ A? host.domain. (29)
21:58:20.464109 IP 10.10.1.120.49321 > 172.29.4.66.domain: 543+ A? www.mimicdns.com. (34)
21:58:20.464404 IP 10.10.1.120.49321 > 172.29.4.66.domain: 544+ A? host.domain. (29)
21:58:20.464522 IP 10.10.1.120.49321 > 172.29.4.66.domain: 545+ A? www.mimicdns.com. (34)
21:58:20.464694 IP 10.10.1.120.49321 > 172.29.4.66.domain: 546+ A? host.domain. (29)
21:58:20.464817 IP 10.10.1.120.49321 > 172.29.4.66.domain: 547+ A? www.mimicdns.com. (34)
21:58:20.464928 IP 10.10.1.120.49321 > 172.29.4.66.domain: 548+ A? host.domain. (29)
21:58:20.465040 IP 10.10.1.120.49321 > 172.29.4.66.domain: 549+ A? www.mimicdns.com. (34)
21:58:20.465212 IP 10.10.1.120.49321 > 172.29.4.66.domain: 550+ A? host.domain. (29)
21:58:20.465327 IP 10.10.1.120.49321 > 172.29.4.66.domain: 551+ A? www.mimicdns.com. (34)
21:58:20.465445 IP 10.10.1.120.49321 > 172.29.4.66.domain: 552+ A? host.domain. (29)
21:58:20.465558 IP 10.10.1.120.49321 > 172.29.4.66.domain: 553+ A? www.mimicdns.com. (34)
21:58:20.465649 IP 10.10.1.120.49321 > 172.29.4.66.domain: 554+ A? host.domain. (29)
21:58:20.465766 IP 10.10.1.120.49321 > 172.29.4.66.domain: 555+ A? www.mimicdns.com. (34)
21:58:20.465892 IP 10.10.1.120.49321 > 172.29.4.66.domain: 556+ A? host.domain. (29)
21:58:20.466099 IP 10.10.1.120.49321 > 172.29.4.66.domain: 557+ A? www.mimicdns.com. (34)
21:58:20.466210 IP 10.10.1.120.49321 > 172.29.4.66.domain: 558+ A? host.domain. (29)
21:58:20.466323 IP 10.10.1.120.49321 > 172.29.4.66.domain: 559+ A? www.mimicdns.com. (34)
21:58:20.466437 IP 10.10.1.120.49321 > 172.29.4.66.domain: 560+ A? host.domain. (29)
21:58:40.460290 IP 10.10.1.120.49321 > 172.29.4.66.domain: 561+ A? www.mimicdns.com. (34)
21:58:40.460433 IP 10.10.1.120.49321 > 172.29.4.66.domain: 562+ A? host.domain. (29)
21:58:40.460546 IP 10.10.1.120.49321 > 172.29.4.66.domain: 563+ A? www.mimicdns.com. (34)
21:58:40.460842 IP 10.10.1.120.49321 > 172.29.4.66.domain: 564+ A? host.domain. (29)
21:58:40.461053 IP 10.10.1.120.49321 > 172.29.4.66.domain: 565+ A? www.mimicdns.com. (34)
21:58:40.461153 IP 10.10.1.120.49321 > 172.29.4.66.domain: 566+ A? host.domain. (29)
21:58:40.461215 IP 10.10.1.120.49321 > 172.29.4.66.domain: 567+ A? www.mimicdns.com. (34)
21:58:40.461247 IP 10.10.1.120.49321 > 172.29.4.66.domain: 568+ A? host.domain. (29)
21:58:40.461330 IP 10.10.1.120.49321 > 172.29.4.66.domain: 569+ A? www.mimicdns.com. (34)
21:58:40.461415 IP 10.10.1.120.49321 > 172.29.4.66.domain: 570+ A? host.domain. (29)
21:58:40.461527 IP 10.10.1.120.49321 > 172.29.4.66.domain: 571+ A? www.mimicdns.com. (34)
21:58:40.461597 IP 10.10.1.120.49321 > 172.29.4.66.domain: 572+ A? host.domain. (29)
21:58:40.461710 IP 10.10.1.120.49321 > 172.29.4.66.domain: 573+ A? www.mimicdns.com. (34)
21:58:40.461786 IP 10.10.1.120.49321 > 172.29.4.66.domain: 574+ A? host.domain. (29)
21:58:40.461861 IP 10.10.1.120.49321 > 172.29.4.66.domain: 575+ A? www.mimicdns.com. (34)
21:58:40.461923 IP 10.10.1.120.49321 > 172.29.4.66.domain: 576+ A? host.domain. (29)
21:58:40.461958 IP 10.10.1.120.49321 > 172.29.4.66.domain: 577+ A? www.mimicdns.com. (34)
21:58:40.462096 IP 10.10.1.120.49321 > 172.29.4.66.domain: 578+ A? host.domain. (29)
21:58:40.462176 IP 10.10.1.120.49321 > 172.29.4.66.domain: 579+ A? www.mimicdns.com. (34)
21:58:40.462287 IP 10.10.1.120.49321 > 172.29.4.66.domain: 580+ A? host.domain. (29)

